,headline,final_score,datetime
0,T. Rowe Price Group Inc. stock outperforms market despite losses on the day,86,2023-05-04 10:28:00
1,T. Rowe Price Group Inc. stock outperforms competitors despite losses on the day,86,2023-05-03 10:28:00
2,Wells Fargo Maintains Price (T.) Rowe Group (TROW) Equal-Weight Recommendation,86,2023-05-03 09:14:44
3,T. Rowe Price price target lowered to $99 from $105 at Deutsche Bank,86,2023-05-03 02:16:00
4,T. Rowe Price price target lowered to $108 from $115 at Wells Fargo,86,2023-05-03 01:18:00
5,"Analysts Offer Insights on Financial Companies: T Rowe Price (TROW), Colliers International Group (CIGI) and TMX Group (OtherTMXXF)",86,2023-05-02 23:21:00
6,Q1 2023 T Rowe Price Group Inc Earnings Call,86,2023-05-02 18:41:59
7,Trust T. Rowe Price For The Long Haul,86,2023-05-02 10:27:12
8,"T. Rowe Price Group Inc. stock falls Tuesday, underperforms market",86,2023-05-02 10:27:00
9,"T. Rowe Price (TROW) Q1 Earnings Beat Estimates, AUM Dips Y/Y",86,2023-05-02 08:23:03
11,Everyone Is Down on T. Rowe Price; Here's Why I Love It,86,2023-05-02 04:30:00
12,T. ROWE PRICE GROUP REPORTS FIRST QUARTER 2023 RESULTS,86,2023-05-02 04:00:00
13,"T. Rowe Price Group, Inc. (TROW) Q1 2023 Earnings Call Transcript",86,2023-05-02 02:37:06
14,T. Rowe Price 1Q Net Falls Amid Outflows,86,2023-05-02 00:36:00
15,T. Rowe: Q1 Earnings Snapshot,68,2023-05-02 00:22:00
16,"T. Rowe Price Q1 earnings reflect improved investment performance, lower expenses",86,2023-05-01 23:51:00
17,"T. Rowe Price reports Q1 adjusted EPS $1.69, consensus $1.64",86,2023-05-01 23:07:00
18,"T. Rowe Price Non-GAAP EPS of $1.69 beats by $0.06, revenue of $1.54B in-line",86,2023-05-01 23:06:00
19,"T. Rowe Price Group Inc. stock falls Monday, underperforms market",86,2023-05-01 10:26:00
20,T. Rowe and PGIM See Credit Outperforming Even If a Downturn Comes,86,2023-05-01 08:42:04
22,T. Rowe Price Q1 2023 Earnings Preview,86,2023-04-30 18:35:00
26,T. Rowe Price Group Inc. stock underperforms Friday when compared to competitors despite daily gains,86,2023-04-28 10:26:00
27,T. Rowe Price Group Inc. stock outperforms competitors on strong trading day,86,2023-04-27 10:28:00
28,Is T. Rowe Price Real Estate (TRREX) a Strong Mutual Fund Pick Right Now?,86,2023-04-27 04:00:11
29,What's in Store for T. Rowe Price (TROW) in Q1 Earnings?,86,2023-04-26 07:06:02
34,T. Rowe Price Group Inc. stock outperforms market on strong trading day,86,2023-04-24 10:27:00
35,"T. ROWE PRICE: AUTO-SOLUTIONS CONTINUED TO POSITIVELY INFLUENCE 401(k) SAVINGS BEHAVIOR IN 2022, EVEN AMID MARKET UNCERTAINTIES",86,2023-04-24 07:30:00
41,"T. ROWE PRICE COMPLETES ACQUISITION OF RETIREE, INC.",86,2023-04-20 06:15:00
44,T. Rowe Price Group Inc. stock underperforms Wednesday when compared to competitors,86,2023-04-19 10:27:00
46,T. Rowe Price Group Inc. stock underperforms Tuesday when compared to competitors,86,2023-04-18 10:26:00
49,"T. Rowe Price Group Inc. stock rises Monday, outperforms market",86,2023-04-17 10:26:00
54,Morgan Stanley Maintains Price T. Rowe Group (TROW) Equal-Weight Recommendation,86,2023-04-14 16:29:20
55,Wells Fargo Maintains Price T. Rowe Group (TROW) Equal-Weight Recommendation,86,2023-04-14 16:29:04
56,Morgan Stanley Keeps Their Hold Rating on T Rowe Price (TROW),86,2023-04-14 00:25:00
57,T. Rowe Price price target raised to $115 from $112 at Wells Fargo,86,2023-04-13 22:26:00
59,Evercore ISI Group Maintains Price  Rowe Group (TROW) In-Line Recommendation,86,2023-04-13 14:31:11
60,"T. Rowe Price Group Inc. stock rises Thursday, outperforms market",86,2023-04-13 10:26:00
61,T. ROWE PRICE GROUP REPORTS PRELIMINARY MONTH-END ASSETS UNDER MANAGEMENT FOR MARCH 2023,86,2023-04-13 05:30:00
62,T. Rowe Price AUM grows to $1.34T in March,86,2023-04-13 00:59:00
63,T. Rowe Price price target lowered to $98 from $101 at Evercore ISI,86,2023-04-13 00:32:00
64,T. Rowe Price reports preliminary AUM $1.34T at March 31,86,2023-04-13 00:31:00
65,"T. Rowe Price Releases Its 2022 Community Snapshot, Reinforces Its Commitment to Community",86,2023-04-12 11:20:00
67,T. Rowe Price Group Should Be On Your Watchlist,86,2023-04-12 02:44:05
70,Unusual Put Option Trade in Price  Rowe Group (TROW)  Worth $59.23K,86,2023-04-11 14:23:01
71,"T. Rowe Price Group Inc. stock rises Tuesday, outperforms market",86,2023-04-11 10:26:00
72,T. Rowe Price to buy Kansas-based retirement software company,86,2023-04-10 11:48:22
73,T. Rowe Price Group Inc. stock underperforms Monday when compared to competitors despite daily gains,86,2023-04-10 10:26:00
75,T. Rowe Price Group Inc. stock underperforms Thursday when compared to competitors,86,2023-04-06 10:26:00
77,"T. Rowe Price: Bearish Unconfirmed Earnings Date, Fund Outflows May Persist",86,2023-04-06 03:47:53
78,B of A Securities Maintains Price  Rowe Group (TROW) Underperform Recommendation,86,2023-04-06 03:00:34
79,"T. Rowe Price Group Inc. stock falls Wednesday, underperforms market",86,2023-04-05 10:26:00
80,"With 78% ownership of the shares, T. Rowe Price Group, Inc. (NASDAQ:TROW) is heavily dominated by institutional owners",86,2023-04-05 04:07:03
81,Is T. Rowe Price Emerging Markets Stock (PRMSX) a Strong Mutual Fund Pick Right Now?,86,2023-04-05 04:00:11
82,T. Rowe Price price target lowered to $72 from $78 at BofA,86,2023-04-04 23:40:00
84,T. Rowe Price Executives Named to Barron's Top 100 Influential Women in U.S. Finance 2023 List,86,2023-04-04 07:10:00
85,T. Rowe Price Executives Named to Barron`s Top 100 Influential Women in U.S. Finance 2023 List,86,2023-04-04 02:11:00
86,T. Rowe Price Group Inc. stock underperforms Monday when compared to competitors,86,2023-04-03 10:26:00
88,"T. Rowe (TROW) to Buy Retiree, Ups Retirement Planning Ability",86,2023-03-31 07:51:02
89,Retirement Plans? - T. Rowe Price Bolsters Its Position Via This Fintech Firm Acquisition,86,2023-03-30 10:02:54
92,"T. ROWE PRICE TO ACQUIRE RETIREE, INC., BOLSTERING RETIREMENT INCOME CAPABILITIES",86,2023-03-30 05:00:00
93,T. Rowe Price to acquire fintech firm Retiree,86,2023-03-30 00:09:00
94,"T. Rowe Price to acquire Retiree Inc., terms not disclosed",86,2023-03-30 00:04:00
101,"T. Rowe Price Group Inc. stock rises Friday, outperforms market",86,2023-03-24 10:26:00
102,"Organic Growth Aids T. Rowe Price (TROW), High Costs Ail",86,2023-03-22 06:04:01
103,T. ROWE PRICE PUBLISHES 2022 YEAR-END REPORT FEATURING 401(k) PLAN SPONSOR AND PARTICIPANT BEHAVIOR AMID INFLATION AND MARKET VOLATILITY,86,2023-03-21 09:42:00
104,"For This Bond Manager, Bank Failures Don’t Add Up to a Crisis. What Could Change That.",86,2023-03-21 08:28:00
109,"T. Rowe Price Group Inc. stock rises Thursday, still underperforms market",86,2023-03-16 10:26:00
110,Is T. Rowe Price Global Stock (PRGSX) a Strong Mutual Fund Pick Right Now?,86,2023-03-16 04:00:11
112,T. Rowe Price (TROW) Gains As Market Dips: What You Should Know,86,2023-03-15 15:15:10
113,"T. Rowe Price Group Inc. stock rises Tuesday, still underperforms market",86,2023-03-14 10:27:00
114,T. Rowe Price: Women Significantly Lag Behind Men in Retirement Savings,86,2023-03-14 09:15:00
117,T. Rowe Price's (TROW) February AUM Down 2.6% to $1.31T,86,2023-03-13 04:11:11
121,"T. Rowe Price Group Inc. stock falls Friday, underperforms market",86,2023-03-10 09:27:00
123,T. Rowe Price Group Reports Preliminary Month-End Assets Under Management For December 2020,86,2021-01-13 05:30:00
124,Why Is T. Rowe Price's Dividend So High?,86,2023-03-10 02:30:00
125,T. ROWE PRICE GROUP REPORTS PRELIMINARY MONTH-END ASSETS UNDER MANAGEMENT FOR FEBRUARY 2023,86,2023-03-10 00:30:00
126,"T. Rowe Price AUM slips to $1.31T in February, hurt by outflows",86,2023-03-09 23:59:00
127,T. Rowe Price reports preliminary AUM $1.31T at February 28,86,2023-03-09 23:31:00
129,"T. Rowe Price Group Inc. stock falls Thursday, still outperforms market",86,2023-03-09 09:27:00
131,"T. Rowe Price Group, Inc. (NASDAQ:TROW) Will Pay A US$1.22 Dividend In Four Days",86,2023-03-09 02:48:41
133,T. Rowe Price: Uncertainty Spells Opportunity,86,2023-03-08 00:05:00
135,T. Rowe Price (TROW) Outpaces Stock Market Gains: What You Should Know,86,2023-03-06 15:15:11
136,T. ROWE PRICE ANNOUNCES KELLY SHEN AS CHIEF DATA OFFICER,86,2023-03-06 08:00:00
137,Is T. Rowe Price Science & Technology Fund (PRSCX) a Strong Mutual Fund Pick Right Now?,86,2023-03-06 04:00:12
138,T. Rowe Price appoints Kelly Shen as CDO,86,2023-03-06 02:02:00
139,T. Rowe Price: Another Hike For This Dividend Aristocrat,86,2023-03-06 00:00:00
140,T. Rowe Price Group: Reasonable Valuation And Strong Balance Sheet,86,2023-03-04 19:29:00
