,headline,final_score,datetime
0,Medical Device Maker Stryker Faces New Bribery Concerns,86,2023-05-04 12:00:00
1,Stryker Corp. stock outperforms competitors despite losses on the day,90,2023-05-04 10:26:00
3,Citigroup Maintains Stryker (SYK) Buy Recommendation,86,2023-05-04 03:06:35
4,Stryker Corp. stock underperforms Wednesday when compared to competitors,90,2023-05-03 10:26:00
7,Stryker (SYK) Receives a Hold from JMP Securities,86,2023-05-03 04:25:00
8,Stryker Corp. stock underperforms Tuesday when compared to competitors,90,2023-05-02 10:25:00
9,What's Going On With Stryker Stock Today,86,2023-05-02 08:49:17
10,BAX vs. SYK: Which Stock Should Value Investors Buy Now?,60,2023-05-02 08:40:03
11,Barclays Maintains Stryker (SYK) Overweight Recommendation,86,2023-05-02 06:09:21
12,Baird Maintains Stryker (SYK) Outperform Recommendation,86,2023-05-02 06:09:20
13,Piper Sandler Maintains Stryker (SYK) Overweight Recommendation,86,2023-05-02 06:09:18
14,Canaccord Genuity Maintains Stryker (SYK) Hold Recommendation,86,2023-05-02 06:09:16
15,Morgan Stanley Maintains Stryker (SYK) Equal-Weight Recommendation,86,2023-05-02 06:09:14
16,Wells Fargo Maintains Stryker (SYK) Overweight Recommendation,86,2023-05-02 06:09:14
17,Stryker (SYK) Gets a Buy from Bernstein,86,2023-05-02 05:25:00
19,Stryker completes acquisition of Cerus Endovascular,86,2023-05-02 05:00:00
20,"Analysts Offer Insights on Healthcare Companies: Stryker (SYK), Vertex Pharmaceuticals (VRTX) and Axonics Modulation Technologies (AXNX)",57,2023-05-02 04:32:00
21,"Stryker (SYK) Q1 Earnings Beat Estimates, Volume Improves",86,2023-05-02 03:39:10
22,Stryker price target raised to $292 from $260 at Deutsche Bank,86,2023-05-02 01:53:00
23,Stryker price target raised to $315 from $288 at RBC Capital,86,2023-05-02 01:45:00
26,Stryker price target raised to $330 from $280 at Stifel,86,2023-05-02 00:44:00
27,"Analysts Offer Insights on Healthcare Companies: Incyte (INCY), Stryker (SYK) and Surgery Partners (SGRY)",57,2023-05-02 00:21:00
28,Stryker price target raised to $315 from $285 at JPMorgan,86,2023-05-02 00:10:00
29,Stryker price target raised to $345 from $320 at Jefferies,86,2023-05-01 23:54:00
30,Stryker price target raised to $313 from $299 at BTIG,86,2023-05-01 23:29:00
31,Stryker price target raised to $310 from $280 at Piper Sandler,86,2023-05-01 23:13:00
32,Stryker price target raised to $295 from $250 at Canaccord,86,2023-05-01 23:12:00
33,Stryker price target raised to $315 from $287 at Baird,86,2023-05-01 22:33:00
34,Stryker price target raised to $336 from $285 at Wells Fargo,86,2023-05-01 22:24:00
35,Stryker price target raised to $321 from $314 at Barclays,86,2023-05-01 21:33:00
36,Evercore ISI Keeps Their Buy Rating on Stryker (SYK),86,2023-05-01 20:26:00
37,Stryker (SYK) Tops Q1 Earnings and Revenue Estimates,86,2023-05-01 14:35:09
38,Stryker Corporation (SYK) Q1 2023 Earnings Call Transcript,90,2023-05-01 14:07:10
39,Stryker lifts profit forecast on robust demand for devices,86,2023-05-01 13:57:20
40,Stryker reports first quarter 2023 operating results,86,2023-05-01 13:05:00
41,"Stocks making the biggest moves after hours: Arista Networks, MGM Resorts, Stryker and more",86,2023-05-01 10:26:18
42,Stryker Corp. stock outperforms market on strong trading day,90,2023-05-01 10:25:00
43,Stryker: Q1 Earnings Snapshot,86,2023-05-01 09:29:00
44,Stryker 1Q Sales Increase but Earnings Miss Estimates -- Earnings Review,86,2023-05-01 09:24:00
47,BTIG Sticks to Its Buy Rating for Stryker (SYK),86,2023-05-01 01:05:00
50,Stryker 2023 earnings guidance comes in above consensus,86,2023-04-30 20:58:00
51,"Stryker sees FY23 adjusted EPS $10.05-$10.25, consensus $10.03",86,2023-04-30 20:12:00
52,"Stryker Non-GAAP EPS of $2.14 beats by $0.13, revenue of $4.8B beats by $240M",86,2023-04-30 20:10:00
53,"Stryker reports Q1 EPS $2.14, consensus $2.00",86,2023-04-30 20:10:00
56,Stryker: Consistently Innovative With Steady Profits And Dividends,86,2023-04-29 16:42:14
58,"Stryker Corp. stock rises Friday, still underperforms market",90,2023-04-28 10:25:00
59,"Stryker Expected to Post Higher 1Q Sales, Net Income -- Earnings Preview",86,2023-04-28 07:26:00
60,"Stryker Corp. stock falls Thursday, underperforms market",90,2023-04-27 10:26:00
61,"Stryker: Q1 May Be Fine, But The Prospect Of Outsized Gains Looks Unlikely",86,2023-04-27 09:45:56
62,3 Reasons To Consider Buying Stryker Corporation,90,2023-04-27 08:25:14
63,"Stryker Corp. stock falls Wednesday, still outperforms market",90,2023-04-26 10:25:00
64,Stryker Corp. stock outperforms market despite losses on the day,90,2023-04-25 10:25:00
67,Stryker (SYK) to Report Q1 Earnings: What's in the Cards?,86,2023-04-25 04:30:11
68,Stryker Corp. stock underperforms Monday when compared to competitors,90,2023-04-24 10:25:00
70,Stryker price target raised to $336 from $275 at Bernstein,86,2023-04-22 22:25:00
73,"Stryker Corp. stock rises Friday, outperforms market",90,2023-04-21 10:25:00
74,Here's How Much a $1000 Investment in Stryker Made 10 Years Ago Would Be Worth Today,86,2023-04-20 05:30:12
75,December 15th Options Now Available For Stryker (SYK),86,2023-04-20 03:09:00
76,"Stryker Corp. stock rises Wednesday, outperforms market",90,2023-04-19 10:25:00
77,"Stryker Corp. stock falls Tuesday, underperforms market",90,2023-04-18 10:25:00
78,BTIG Maintains Stryker (SYK) Buy Recommendation,86,2023-04-18 02:27:39
79,Needham med tech analysts to hold an analyst/industry conference call,60,2023-04-17 20:55:00
80,Loop Capital Maintains Stryker (SYK) Buy Recommendation,86,2023-04-17 16:42:54
81,Truist Securities Maintains Stryker (SYK) Hold Recommendation,86,2023-04-17 16:42:46
82,Stryker Corp. stock underperforms Monday when compared to competitors despite daily gains,90,2023-04-17 10:25:00
83,Stryker price target raised to $300 from $275 at Truist,86,2023-04-17 01:21:00
84,Stryker price target raised to $299 from $281 at BTIG,86,2023-04-17 00:44:00
85,"Analysts Offer Insights on Healthcare Companies: UnitedHealth (UNH), Stryker (SYK) and Merus (MRUS)",57,2023-04-16 23:40:00
86,Stryker price target raised to $312 from $290 at Loop Capital,86,2023-04-16 23:24:00
88,Stryker Corp. stock outperforms competitors on strong trading day,90,2023-04-14 10:25:00
89,HAE vs. SYK: Which Stock Is the Better Value Option?,60,2023-04-14 08:40:03
90,"Stryker Corp. stock rises Thursday, still underperforms market",90,2023-04-13 10:25:00
94,Barclays Sticks to Their Buy Rating for Stryker (SYK),86,2023-04-12 01:15:00
95,"Stryker Corp. stock rises Tuesday, outperforms market",90,2023-04-11 10:24:00
97,Stryker (SYK) is a Great Momentum Stock: Should You Buy?,86,2023-04-11 09:00:04
98,Stryker price target raised to $314 from $283 at Barclays,86,2023-04-10 21:49:00
99,"Stryker Corp. stock rises Monday, outperforms market",90,2023-04-10 10:25:00
103,Here's Why You Should Add Stryker (SYK) Stock to Your Portfolio,86,2023-04-06 07:43:02
104,Stryker Corp. stock underperforms Wednesday when compared to competitors despite daily gains,90,2023-04-05 10:25:00
105,Here's How Much You'd Have If You Invested $1000 in Stryker a Decade Ago,86,2023-04-04 05:30:12
106,Stryker price target raised to $326 from $290 at Citi,86,2023-04-02 22:28:00
107,Stryker Corp. stock underperforms Friday when compared to competitors despite daily gains,90,2023-03-31 10:29:00
108,Stryker price target raised to $320 from $292 at Jefferies,86,2023-03-30 21:46:00
110,Stryker to announce financial results for its first quarter of fiscal year 2023,86,2023-03-30 13:05:00
111,"Stryker Corp. stock rises Thursday, outperforms market",90,2023-03-30 10:25:00
112,Stryker Now Offers the Only FDA-Cleared Pyrocarbon Bearing Material Option for Shoulder Hemiarthroplasty,57,2023-03-30 05:27:00
113,UBS Initiates Coverage of Stryker (SYK) with Neutral Recommendation,86,2023-03-29 21:16:06
114,"Stryker Corp. stock rises Wednesday, still underperforms market",90,2023-03-29 10:25:00
115,"Street Wrap: Today`s Top 15 Upgrades, Downgrades, Initiations",52,2023-03-29 05:21:00
116,Stryker initiated with a Neutral at UBS,86,2023-03-29 00:55:00
117,Stryker announces Annual Meeting of Shareholders,86,2023-03-28 10:12:00
118,Canaccord Genuity Sticks to Its Hold Rating for Stryker (SYK),86,2023-03-28 00:35:00
120,Stryker (NYSE:SYK) Could Be A Buy For Its Upcoming Dividend,86,2023-03-25 05:59:56
123,HAE vs. SYK: Which Stock Should Value Investors Buy Now?,60,2023-03-24 08:40:03
124,"Stryker Corp. stock rises Tuesday, still underperforms market",90,2023-03-21 10:25:00
125,"Stryker Corp. stock rises Monday, still underperforms market",90,2023-03-20 10:25:00
127,"Stryker Corp. stock falls Friday, still outperforms market",90,2023-03-17 10:25:00
129,May 19th Options Now Available For Stryker (SYK),86,2023-03-16 04:34:00
130,"Stryker Corp. stock falls Wednesday, underperforms market",90,2023-03-14 21:26:00
133,"Analysts Are Bullish on Top Healthcare Stocks: Palatin Technologies (PTN), Stryker (SYK)",86,2023-03-13 00:51:00
134,Analysts Offer Insights on Healthcare Companies: Stryker (SYK) and Privia Health Group (PRVA),86,2023-03-08 19:40:00
135,ESLOY vs. SYK: Which Stock Is the Better Value Option?,60,2023-03-08 08:40:04
136,Stryker management to meet with BTIG,86,2023-03-07 20:55:00
138,Stryker Corporation (SYK) Rebounded Strongly in Q4,90,2023-03-07 04:27:37
140,Stryker Takes Over #78 Spot From Citigroup,86,2023-03-06 19:41:00
141,"Stryker Corp. stock falls Monday, underperforms market",90,2023-03-06 09:25:00
