,headline,final_score,datetime
6,Nvidia: This Won't End Well (Rating Downgrade),86,2023-05-05 04:04:35
7,Nvidia Stock: This Canary in the Coal Mine Is Singing a Warning,86,2023-05-05 03:20:00
8,Nvidia Stock: Bear vs. Bull,86,2023-05-05 02:48:00
18,"NVIDIA Corp. stock falls Thursday, underperforms market",90,2023-05-04 10:15:00
23,"AMD, Microsoft working on Nvidia AI processor alternative, Bloomberg says",86,2023-05-04 05:26:00
25,Nvidia Vs. AMD - Who Will Win AI In The Short Run?,86,2023-05-04 04:18:26
26,June 23rd Options Now Available For NVIDIA,86,2023-05-04 03:42:00
29,Better Buy: Nvidia vs. AMD,86,2023-05-04 02:40:00
40,Nvidia (NVDA) Dips More Than Broader Markets: What You Should Know,86,2023-05-03 14:45:09
41,Is AMD Trying to Mimic Nvidia's Success in Artificial Intelligence?,86,2023-05-03 14:31:38
42,NVIDIA Sets Conference Call for First-Quarter Financial Results,86,2023-05-03 14:00:00
44,What's Going On With NVIDIA Stock Today,86,2023-05-03 12:02:05
45,"Final Trades: Energy Transfer, HYG, Nvidia, Sonos",86,2023-05-03 11:59:24
47,"NVIDIA Corp. stock falls Wednesday, underperforms market",90,2023-05-03 10:14:00
48,Nvidia short sellers lose $5 billion as shares rise more than 90% in 2023,86,2023-05-03 09:36:36
49,Nvidia: P/E-Growth Gap Is Undoubtedly Elevated (Rating Downgrade),86,2023-05-03 06:19:25
50,Even AI Wasn't Enough to Save AMD. What Does This Mean for Nvidia?,86,2023-05-03 06:08:27
56,"Apple, Tesla, and Nvidia Have Propped Up the S&P 500. Powell May Fuel More Gains.",86,2023-05-03 04:44:00
61,Nvidia Is Creating Safety Solutions for AI Chatbots,86,2023-05-03 03:00:00
74,"NVIDIA Corp. stock falls Tuesday, underperforms market",90,2023-05-02 10:14:00
78,Nvidia Stock Nearly Doubles In 2023 Amid AI Frenzy — Is It A Buy?,86,2023-05-02 09:21:48
80,"As Nvidia's Stock Pulls Back, Here's What Traders Should Do",86,2023-05-02 07:20:00
95,Why Nvidia Stock Jumped Up 4% on Monday,86,2023-05-01 18:00:51
96,Nvidia's AI Foundation Services And NeMo Guardrails: A New Catalyst For Growth,86,2023-05-01 15:36:13
97,Nvidia Stock In Buy Zone After Nearly Doubling In 2023 — Is It A Buy?,86,2023-05-01 14:25:48
98,Dow Jones Dips As Onsemi Earnings Boost Nvidia; JPMorgan Tests Entry As It Eats First Republic,57,2023-05-01 13:32:26
99,"S&P 500: Nvidia Stock Is A Top Performer, While Regional Banks Skid",86,2023-05-01 13:26:54
101,Game Time: Nvidia Stock Leads Nine Stocks Set To Report In May,86,2023-05-01 11:18:26
102,Nvidia Stock Broke Out of Resistance; Here's Where It Might Go Next,86,2023-05-01 11:30:00
103,"Nvidia, the Market Leader, is Breaking Out on Volume",86,2023-05-01 11:22:06
104,"Nvidia, IBD Stock Of The Day, Hits Buy Point On AI Enthusiasm",86,2023-05-01 10:52:40
105,A feared tech ‘earnings apocalypse’ hasn’t happened. But Apple and Nvidia could shake things up,57,2023-05-01 10:42:29
106,"NVIDIA Corp. stock rises Monday, outperforms market",90,2023-05-01 10:13:00
107,ON Semi jumps after results while Nvidia hits 13 month high,86,2023-05-01 10:09:39
108,This Bull Call Spread On Nvidia Stock Has Great Upside Potential,86,2023-05-01 07:16:07
113,Nvidia hits one-year high as positive AI sentiment continues to abound,86,2023-05-01 03:45:00
117,Nvidia`s AI Foundation Services And NeMo Guardrails: A New Catalyst For Growth,86,2023-05-01 02:40:00
120,"Hot Stocks: NVDA hits 52-week high; NWL drops on earnings, TGTX surges; VLY downgrade",60,2023-04-30 21:49:00
121,NVDA Surges to Yearly High on AI Enthusiasm,60,2023-04-30 21:07:00
122,Why did Nvidia stock go up today? AI enthusiasm continues to rise,86,2023-04-30 20:34:00
123,NVDA Surges to Yearly High on A.I. Enthusiasm,60,2023-04-30 19:47:00
127,Those who invested in NVIDIA (NASDAQ:NVDA) five years ago are up 369%,86,2023-04-30 05:00:22
129,"Giant Fund Sells Apple, Tesla, Intel, and Nvidia Stock",86,2023-04-30 05:00:00
131,These 3 Chip Stocks Could Outperform Nvidia Over the Next 5 Years,86,2023-04-29 18:31:00
135,"SoftBank`s Arm files confidentially for U.S. IPO, Reuters reports",55,2023-04-29 04:48:00
138,"Keep on Buying Nvidia Stock Ahead of Earnings, Says Morgan Stanley",86,2023-04-28 11:15:00
139,What's Going On With Nvidia Shares Today,86,2023-04-28 10:58:12
140,"NVIDIA Corp. stock rises Friday, outperforms market",90,2023-04-28 10:13:00
145,Why Nvidia's AI Technology Is Essential for the Autonomous Vehicle Industry,86,2023-04-28 03:05:00
162,Nvidia's Conversation Starter,86,2023-04-27 09:00:22
164,CNBC's Stock Draft: WWE Superstar Charlotte Flair picks Nvidia first overall,86,2023-04-27 07:46:42
167,The AI Revolution: How Companies like Nvidia and Tesla Are Leading the Way,86,2023-04-27 04:15:00
169,NVDA June 9th Options Begin Trading,60,2023-04-27 03:31:00
170,Did Tesla and Elon Musk Just Throw Nvidia Stock Investors a Huge Lifeline?,86,2023-04-27 03:00:00
172,Reasons for the Outperformance of NVIDIA Corporation (NVDA),90,2023-04-27 01:05:41
179,Nvidia says cloud gaming providers would benefit from Microsoft-Activision deal,86,2023-04-26 21:38:00
180,"NVIDIA Corp. stock rises Thursday, still underperforms market",90,2023-04-26 21:16:00
184,Unusual Put Option Trade in NVIDIA (NVDA)  Worth $815.00K,86,2023-04-26 14:16:55
185,"Unusual Put Option Trade in NVIDIA (NVDA)  Worth $1,979.99K",86,2023-04-26 14:04:22
188,NVIDIA Corporation (NVDA) Is a Trending Stock: Facts to Know Before Betting on It,90,2023-04-26 06:00:01
191,"AMD, Nvidia, Intel lead semis higher in wake of tepid results from TI",86,2023-04-26 04:24:00
196,"Microsoft's stock rally buoys Amazon and Nvidia shares, Activision Blizzard stock tumbles, and other stocks on the move",57,2023-04-26 00:55:00
199,5 big analyst picks: NVIDIA upgraded to Buy on data center growth | Pro Recap,86,2023-04-25 22:34:36
202,"NVIDIA Corp. stock rises Wednesday, outperforms market",90,2023-04-25 21:15:00
204,Nvidia May Have Just Solved AI's Biggest Problem,86,2023-04-25 15:17:45
206,Nvidia releases software tools to help chatbots watch their language,86,2023-04-25 11:47:14
207,Nvidia stock gains as Microsoft details plans to spend on AI infrastructure,86,2023-04-25 11:44:00
209,Medtronic Is Partnering With Nvidia to Create Potentially Game-Changing Tech. Is the Stock a Buy?,57,2023-04-25 11:14:00
