,headline,final_score,datetime
0,Corning Inc. stock underperforms Thursday when compared to competitors,86,2023-05-04 09:57:00
1,Interesting GLW Put And Call Options For June 23rd,60,2023-05-04 03:00:00
2,"Corning said to shut down research center in Israel, cutting all jobs",86,2023-05-04 02:26:00
3,Corning Inc. stock underperforms Wednesday when compared to competitors,86,2023-05-03 09:57:00
4,"Corning Inc. stock falls Tuesday, underperforms market",86,2023-05-02 09:57:00
5,Corning Incorporated (NYSE:GLW) Q1 2023 Earnings Call Transcript,86,2023-05-02 05:45:58
7,Corning Inc. stock outperforms competitors despite losses on the day,86,2023-05-01 09:56:00
10,Corning's (NYSE:GLW) Dividend Will Be Increased To $0.28,86,2023-05-01 03:05:30
11,Corning (GLW) Declares $0.28 Dividend,86,2023-04-30 17:54:17
12,Corning Inc. stock outperforms market on strong trading day,86,2023-04-28 09:56:00
13,"Zacks Industry Outlook Highlights Arista Networks, Corning and TESSCO",86,2023-04-28 02:00:09
14,"Analysts` Top Technology Picks: Corning (GLW), T Mobile US (TMUS)",86,2023-04-27 23:30:00
15,Corning Announces Quarterly Dividend,86,2023-04-27 07:09:00
17,Corning: Expecting Improvement In Q2,86,2023-04-27 03:30:59
18,Interesting GLW Put And Call Options For June 9th,60,2023-04-27 02:55:00
19,Corning declares $0.28 dividend,86,2023-04-27 02:14:00
20,Corning: I'm Buying The Drop,86,2023-04-27 01:20:00
21,Corning: I`m Buying The Drop,86,2023-04-27 00:24:00
22,Barclays Maintains Corning (GLW) Equal-Weight Recommendation,86,2023-04-26 18:53:51
23,Credit Suisse Reiterates Corning (GLW) Outperform Recommendation,86,2023-04-26 18:53:51
24,"Corning Inc. stock falls Wednesday, underperforms market",86,2023-04-26 09:56:00
25,Deutsche Bank Maintains Corning (GLW) Buy Recommendation,86,2023-04-26 03:14:22
26,"Analysts Offer Insights on Technology Companies: Brightcove (BCOV), Corning (GLW) and Enphase Energy (ENPH)",86,2023-04-26 00:31:00
27,Corning price target lowered to $39 from $40 at UBS,86,2023-04-25 23:24:00
29,Q1 2023 Corning Inc Earnings Call,86,2023-04-25 21:43:24
30,Corning price target lowered to $33 from $35 at Barclays,86,2023-04-25 21:22:00
31,Corning price target lowered to $37 from $38 at Deutsche Bank,86,2023-04-25 20:42:00
32,"Corning Faces 10% Core Sales Decrease in Q1, Cautions Against Persisting Demand Softness for Q2",86,2023-04-25 10:36:23
33,Corning (GLW) Beats on Q1 Earnings Despite Lower Revenues,86,2023-04-25 09:32:04
34,"Corning, Inc. (GLW) Q1 2023 Earnings Call Transcript",86,2023-04-25 06:06:03
35,Apple supplier Corning rides on price hikes to beat profit estimates,86,2023-04-25 05:22:57
36,Corning Reports First-Quarter 2023 Financial Results,86,2023-04-25 04:10:00
37,Corning: Q1 Earnings Snapshot,86,2023-04-25 00:21:00
38,"New Buy Rating for Corning (GLW), the Technology Giant",86,2023-04-24 23:55:00
39,"Corning Non-GAAP EPS of $0.41 beats by $0.02, revenue of $3.37B beats by $20M",86,2023-04-24 23:14:00
40,"Corning sees Q2 core EPS 42c-49c, consensus 48c",86,2023-04-24 23:14:00
41,"Corning reports Q1 core EPS 41c, consensus 39c",86,2023-04-24 23:13:00
42,Barclays Sticks to Their Hold Rating for Corning (GLW),86,2023-04-24 19:15:00
44,Corning Q1 2023 Earnings Preview,86,2023-04-24 04:12:00
45,"The Zacks Analyst Blog Highlights General Electric, Kimberly-Clark, Corning, Raytheon Technologies and Align Technology",86,2023-04-24 03:53:10
47,Corning Inc. stock underperforms Friday when compared to competitors,86,2023-04-21 09:57:00
49,"Analysts` Opinions Are Mixed on These Technology Stocks: Corning (GLW), Iridium Communications (IRDM) and T Mobile US (TMUS)",60,2023-04-20 21:21:00
50,Notable Two Hundred Day Moving Average Cross - GLW,60,2023-04-20 02:59:00
51,July 21st Options Now Available For Corning (GLW),86,2023-04-20 02:59:00
52,JP Morgan Maintains Corning (GLW) Overweight Recommendation,86,2023-04-19 19:47:51
53,Will Top-Line Contraction Affect Corning's (GLW) Q1 Earnings?,86,2023-04-19 06:56:01
54,J.P. Morgan Sticks to Its Buy Rating for Corning (GLW),86,2023-04-19 04:26:00
55,Corning (GLW) Expected to Beat Earnings Estimates: Should You Buy?,86,2023-04-18 07:01:02
56,Corning Inc. stock underperforms Tuesday when compared to competitors,86,2023-04-17 20:58:00
57,Corning Inc. stock underperforms Monday when compared to competitors,86,2023-04-16 20:58:00
58,"Corning Inc. stock rises Thursday, still underperforms market",86,2023-04-13 09:56:00
59,Corning and Memorial Sloan Kettering Cancer Center Announce Health Equity Fellowship to Explore Disparities in Cancer Outcomes,57,2023-04-13 05:00:00
60,GLW June 2nd Options Begin Trading,60,2023-04-13 03:34:00
61,"Corning, MSK announce health equity fellowship to explore disparities in cancer",86,2023-04-13 00:15:00
62,Unusual Call Option Trade in Corning (GLW)  Worth $276.15K,86,2023-04-12 14:26:52
64,Corning Inc. stock outperforms competitors on strong trading day,86,2023-04-10 09:56:00
65,"Analysts Offer Insights on Technology Companies: Boeing (BA), Ciena (CIEN) and Corning (GLW)",86,2023-04-07 02:20:00
66,"Corning Inc. stock falls Thursday, underperforms market",86,2023-04-06 09:56:00
68,"Corning Inc. stock falls Monday, underperforms market",86,2023-04-03 09:56:00
73,"Corning Inc. stock rises Friday, still underperforms market",86,2023-03-31 09:58:00
74,What Awaits Science Applications (SAIC) This Earnings Season?,55,2023-03-31 05:22:12
76,"Corning Inc. stock rises Thursday, outperforms market",86,2023-03-30 09:56:00
77,Corning (GLW) Sets Up Manufacturing Campus in North Carolina,86,2023-03-30 08:01:03
78,Corning Incorporated Named ENERGY STAR Partner of the Year for 10th Year in a Row,86,2023-03-30 04:51:00
79,May 12th Options Now Available For Corning (GLW),86,2023-03-30 03:45:00
81,Deutsche Bank Upgrades Corning (GLW),86,2023-03-27 13:20:34
82,When Should You Buy Corning Incorporated (NYSE:GLW)?,86,2023-03-27 12:53:24
84,"Corning Fundamentals Are Bottoming. It’s Time to Buy the Stock, Says Analyst.",86,2023-03-27 04:59:00
85,What You Missed On Wall Street This Morning,55,2023-03-27 04:04:00
86,Micron (MU) to Report Q2 Earnings: What's in the Offing?,55,2023-03-27 04:01:11
90,Deutsche Bank sees positive inflections ahead for Corning,86,2023-03-26 23:02:00
91,Corning upgraded to Buy from Hold at Deutsche Bank,86,2023-03-26 20:48:00
94,"Corning Inc. stock rises Friday, outperforms market",86,2023-03-24 09:56:00
95,May 5th Options Now Available For Corning (GLW),86,2023-03-23 03:01:00
97,"Corning Inc. stock rises Tuesday, still underperforms market",86,2023-03-14 09:57:00
99,Corning (GLW) Shares Cross Below 200 DMA,86,2023-03-09 18:04:00
100,Corning: Rebound Likely In The Second Half Of 2023,86,2023-03-08 20:48:21
101,Interesting GLW Put And Call Options For April 28th,60,2023-03-08 17:48:00
102,Corning: Time To Increase Your Position,86,2023-03-07 21:42:39
103,"Corning Incorporated (GLW) Morgan Stanley Technology, Media & Telecom Conference (Transcript)",86,2023-03-07 05:57:24
104,Corning (GLW) Unveils Easily Deployable Data Center Solution,86,2023-03-06 07:59:03
105,"Infinera, Corning announce transmission of 400 GB/s wavelengths",86,2023-03-05 23:23:00
106,"Corning Now #260 Largest Company, Surpassing Discover Financial Services",86,2023-03-05 19:36:00
