,headline,final_score,datetime
1,"D.R. Horton Inc. stock falls Thursday, underperforms market",86,2023-05-04 09:49:00
3,"The Zacks Analyst Blog Highlights Beazer Homes, D.R. Horton, PulteGroup, M/I Homes and NVR",86,2023-05-04 02:26:09
5,D.R. Horton Inc. stock outperforms competitors on strong trading day,86,2023-05-03 09:49:00
8,D.R. Horton Inc. stock outperforms market on strong trading day,86,2023-05-02 09:49:00
9,"The Zacks Analyst Blog Highlights Meta Platforms, Watsco, PulteGroup, D.R. Horton and Manhattan Associates",86,2023-05-02 02:20:09
12,"D.R. Horton Inc. stock falls Monday, underperforms market",86,2023-05-01 09:48:00
15,"Analysts Just Made A Meaningful Upgrade To Their D.R. Horton, Inc. (NYSE:DHI) Forecasts",86,2023-04-29 05:06:13
16,"Big Pension Exited First Republic Stock, Bought AMC and DR Horton",86,2023-04-29 05:00:00
18,How We Handled Earnings For DHI Stock,60,2023-04-28 12:40:24
19,Here's What We Like About D.R. Horton's (NYSE:DHI) Upcoming Dividend,86,2023-04-28 03:14:35
25,D.R. Horton Inc. stock underperforms Wednesday when compared to competitors,86,2023-04-26 09:49:00
26,Why D.R. Horton (DHI) Might be Well Poised for a Surge,86,2023-04-26 09:20:04
27,Here's How Much You'd Have If You Invested $1000 in D.R. Horton a Decade Ago,86,2023-04-26 05:30:12
28,"Keefe, Bruyette & Woods Maintains D.R. Horton (DHI) Market Perform Recommendation",86,2023-04-25 11:06:58
29,"D.R. Horton Inc. stock falls Tuesday, still outperforms market",86,2023-04-25 09:49:00
30,"Are You Looking for a Top Momentum Pick? Why Vita Coco Company, Inc. (COCO) is a Great Choice",86,2023-04-19 09:00:04
33,D.R. Horton (DHI) Reports Q2 Earnings: What Key Metrics Have to Say,86,2023-04-25 06:30:01
37,Citigroup Maintains D.R. Horton (DHI) Buy Recommendation,86,2023-04-24 15:00:04
39,Credit Suisse Maintains D.R. Horton (DHI) Neutral Recommendation,86,2023-04-24 10:11:48
45,D.R. Horton price target raised to $100 from $85 at Credit Suisse,86,2023-04-23 23:10:00
46,D.R. Horton price target raised to $125 from $114 at Keefe Bruyette,86,2023-04-23 20:35:00
47,D.R. Horton (NYSE:DHI) Has Announced That It Will Be Increasing Its Dividend To $0.25,86,2023-04-23 05:08:19
50,Beat of the Week: D.R. Horton's Earnings Surprise a Precursor to Housing Revival?,86,2023-04-22 05:01:00
51,D.R. Horton price target raised to $124 from $115 at Citi,86,2023-04-22 03:43:00
53,D.R. Horton (DHI) Declares $0.25 Dividend,86,2023-04-21 14:29:21
55,Why D.R. Horton Stock Jumped This Week,86,2023-04-21 10:15:00
56,D.R. Horton Inc. stock underperforms Friday when compared to competitors,86,2023-04-21 09:49:00
57,JMP Securities Maintains D.R. Horton (DHI) Outperform Recommendation,86,2023-04-21 08:43:04
58,UBS Maintains D.R. Horton (DHI) Buy Recommendation,86,2023-04-21 08:43:02
59,Goldman Sachs Maintains D.R. Horton (DHI) Neutral Recommendation,86,2023-04-21 08:43:01
60,B of A Securities Maintains D.R. Horton (DHI) Buy Recommendation,86,2023-04-21 08:42:59
61,Barclays Maintains D.R. Horton (DHI) Overweight Recommendation,86,2023-04-21 08:42:58
62,RBC Capital Maintains D.R. Horton (DHI) Underperform Recommendation,86,2023-04-21 08:42:57
63,D.R. Horton Earnings Add To Signs Of Housing Market Recovery; DHI Stock Spikes,86,2023-04-20 13:40:37
64,Housing ETFs Up on D.R. Horton's Upbeat Earnings,86,2023-04-21 05:00:12
65,Q2 2023 Forestar Group Inc Earnings Call,86,2023-04-21 03:13:20
66,D.R. Horton price target raised to $98 from $76 at RBC Capital,86,2023-04-21 01:11:00
67,BTIG Sticks to Its Buy Rating for DR Horton (DHI),86,2023-04-21 00:35:00
68,D.R. Horton price target raised to $122 from $116 at BofA,86,2023-04-20 23:40:00
69,Horton Reaches Analyst Target Price,86,2023-04-20 23:15:00
70,D.R. Horton price target raised to $134 from $122 at UBS,86,2023-04-20 22:41:00
71,D.R. Horton price target raised to $130 from $115 at JMP Securities,86,2023-04-20 22:03:00
72,D.R. Horton price target raised to $131 from $114 at Barclays,86,2023-04-20 21:58:00
73,Bank of America Securities Reaffirms Their Buy Rating on DR Horton (DHI),86,2023-04-20 21:26:00
74,Q2 2023 DR Horton Inc Earnings Call,86,2023-04-20 21:01:03
75,Barclays Keeps Their Buy Rating on DR Horton (DHI),86,2023-04-20 20:26:00
76,Homebuilders Ride D.R. Horton Jump to Highest Since January 2022,86,2023-04-20 13:29:30
77,"D.R. Horton stock jumps following Q2 earnings beat, optimistic guidance in housing market",86,2023-04-20 12:47:06
78,Homebuilder D.R. Horton surges as 'encouraging' housing market boosts results,86,2023-04-20 10:27:26
79,"D.R. Horton Inc. stock rises Thursday, outperforms market",86,2023-04-20 09:49:00
80,"ManpowerGroup, Zions fall; D.R. Horton, Lam rise",86,2023-04-20 09:17:00
81,D.R. Horton (DHI) Shares Rise on Q2 Earnings & Revenue Beat,86,2023-04-20 09:02:04
82,"Three-Stock Lunch: AT&T, American Express and DR Horton",86,2023-04-20 08:25:48
83,D.R. Horton forecasts upbeat revenue on strong housing demand,86,2023-04-20 08:07:05
84,"Midday movers: AT&T, Tesla, D.R. Horton and more",86,2023-04-20 07:04:50
85,What Housing Bust? D.R. Horton Stock Soars After Earnings.,86,2023-04-20 06:30:00
87,"D.R. Horton, Inc. (DHI) Q2 2023 Earnings Call Transcript",86,2023-04-20 05:33:10
88,JMP Securities Sticks to Their Buy Rating for DR Horton (DHI),86,2023-04-20 04:55:00
89,D.R. Horton (DHI) Beats Q2 Earnings and Revenue Estimates,86,2023-04-20 04:45:11
91,"DHI Surges as It Defies Mortgage Hikes, Beats Expectations",60,2023-04-20 04:21:00
92,DHI: No Signs Of Housing Weakness,60,2023-04-20 04:15:00
93,"Homebuilder D.R. Horton Defies Mortgage Hikes, Beats Expectations",86,2023-04-20 04:12:00
95,UPDATE 2-US homebuilder D.R. Horton's annual revenue forecast beats estimates,86,2023-04-20 03:42:22
96,US homebuilder D.R. Horton reports fall in quarterly profit,86,2023-04-20 03:36:41
97,"D.R. Horton, Inc., America’s Builder, Reports Fiscal 2023 Second Quarter Earnings and Declares Quarterly Dividend of $0.25 Per Share",86,2023-04-20 03:30:00
99,D.R. Horton rises 7.1%,70,2023-04-20 02:00:00
101,"D.R. Horton stock jumps after fiscal Q2 earnings smash estimates, strong guidance",86,2023-04-20 01:27:00
102,"D.R. Horton sees Q3 revenue $8B-$8.5B, consensus $7.12B",86,2023-04-20 01:14:00
104,"Tesla's stock slide drags down other carmakers; IBM, D.R. Horton shares rise, and more big movers",86,2023-04-20 00:32:00
106,"D.R. Horton 2Q Earnings, Revenue Top Expectations -- Earnings Review",86,2023-04-20 00:14:00
107,"D.R. Horton’s stock rises toward 15-month high after homebuilder’s big profit and revenue beats, upbeat outlook",86,2023-04-19 23:51:00
109,D.R. Horton: Fiscal Q2 Earnings Snapshot,86,2023-04-19 23:33:00
111,D. R. Horton beats Q2 top and bottom line estimates; initiates FY23 outlook,86,2023-04-19 22:54:00
112,"D.R. Horton`s stock rises toward 15-month high after homebuilder`s big profit and revenue beats, upbeat outlook",86,2023-04-19 22:52:00
113,"D.R. Horton reports Q2 home sales revenues of $7.4B on 19,664 homes closed",86,2023-04-19 22:50:00
114,D. R. Horton declares $0.25 dividend,86,2023-04-19 22:42:00
115,"D.R. Horton sees FY23 revenue $31.5B-$33B, consensus $28.5B",86,2023-04-19 22:38:00
116,D. R. Horton beats Q2 top and bottom line estimates; initiate FY23 outlook,86,2023-04-19 22:37:00
117,"D.R. Horton reports Q2 EPS $2.73, consensus $1.93",86,2023-04-19 22:35:00
118,Goldman Sachs Sticks to Its Buy Rating for DR Horton (DHI),86,2023-04-19 22:15:00
119,"Hot Stocks: NOK, EGBN drop on earnings news; BMI, DHI climb",60,2023-04-19 21:43:00
120,"These Stocks Are Moving the Most Today: Tesla, AT&T, D.R. Horton, Las Vegas Sands, XPO, Novavax, and More",86,2023-04-19 21:34:00
121,"D.R. Horton: Robust Fundamentals, Cheap Valuations, And Skillful Management",86,2023-04-19 21:15:19
125,"D.R. Horton Inc. stock falls Wednesday, underperforms market",86,2023-04-19 09:48:00
127,"D.R. Horton 2Q Profit, Revenue Expected to Fall -- Earnings Preview",86,2023-04-19 06:53:00
129,D. R. Horton Q2 2023 Earnings Preview,86,2023-04-19 04:11:00
131,"D.R. Horton Inc. stock rises Tuesday, outperforms market",86,2023-04-18 09:49:00
132,What to Expect From D.R. Horton's (DHI) Q2 Earnings Release?,86,2023-04-18 07:13:02
134,"D.R. Horton Inc. stock rises Monday, outperforms market",86,2023-04-17 09:48:00
136,Is D.R. Horton Stock A Buy Ahead Of The Q2 Earnings?,86,2023-04-17 02:30:56
137,D.R. Horton Inc. stock outperforms competitors despite losses on the day,86,2023-04-13 09:48:00
139,"D.R. Horton, Inc.'s (NYSE:DHI) Stock's On An Uptrend: Are Strong Financials Guiding The Market?",86,2023-04-12 10:18:27
142,"D.R. Horton, Stock Of The Day: DHI Stock In Buy Zone As Housing Market Improves",86,2023-04-11 13:41:32
149,"D.R. Horton Inc. stock rises Friday, outperforms market",86,2023-03-31 09:49:00
152,"D.R. Horton Inc. stock rises Wednesday, still underperforms market",86,2023-03-29 09:48:00
153,D.R. Horton Inc. stock underperforms Monday when compared to competitors,86,2023-03-27 09:48:00
157,D.R. Horton Inc. stock outperforms market despite losses on the day,86,2023-03-22 09:49:00
159,D.R. Horton downgraded to Peer Perform on valuation at Wolfe Research,86,2023-03-21 22:17:00
160,D.R. Horton downgraded to Peer Perform from Outperform at Wolfe Research,86,2023-03-21 21:58:00
161,"D.R. Horton Inc. stock rises Tuesday, still underperforms market",86,2023-03-21 09:49:00
164,D.R. Horton Stock`s (NYSE:DHI) Next Move Depends on the Fed,86,2023-03-20 21:44:00
166,D.R. Horton Inc. stock underperforms Thursday when compared to competitors despite daily gains,86,2023-03-16 09:48:00
167,DHI November 17th Options Begin Trading,60,2023-03-16 04:48:00
171,"D.R. Horton, Inc. to Release 2023 Second Quarter Earnings on April 20, 2023",86,2023-03-15 06:00:00
