,headline,final_score,datetime
3,"Final Trades: GDX, Aspen Technology, Exxon Mobil, Apple",86,2023-05-04 11:11:30
4,"Exxon Mobil Corp. stock falls Thursday, underperforms market",90,2023-05-04 10:35:00
11,Better Buy: ExxonMobil vs. Kinder Morgan Stock,64,2023-05-04 03:13:00
16,"Exxon breached environmental permit, Guyana`s top court rules",86,2023-05-03 18:36:00
17,"Exxon, Guyana's environmental agency in breach of oil-spill insurance -court",86,2023-05-03 17:52:32
20,"Exxon Mobil Corp. stock falls Wednesday, underperforms market",90,2023-05-03 10:34:00
29,TechnipFMC secures large subsea contract for ExxonMobil Guyana`s Uaru project,64,2023-05-02 20:15:00
33,"Why Oil and Gas Majors Chevron, ExxonMobil, and Petrobras Were Plunging Today",64,2023-05-02 12:22:18
35,"Exxon Mobil Corp. stock falls Tuesday, underperforms market",90,2023-05-02 10:33:00
38,TechnipFMC Awarded Large Subsea Contract for ExxonMobil Guyana’s Uaru Project,64,2023-05-02 09:15:00
43,Exxon Mobil Corporation (XOM) Is a Trending Stock: Facts to Know Before Betting on It,90,2023-05-02 06:00:01
47,Is ExxonMobil Stock a Buy?,68,2023-05-02 02:03:00
50,"Analysts Offer Insights on Utilities Companies: EQT (EQT), Exxon Mobil (XOM) and SM Energy (SM)",86,2023-05-02 00:12:00
51,Exxon Mobil price target raised to $122 from $118 at Morgan Stanley,86,2023-05-02 00:11:00
56,SBM Offshore wins $3B pact from Exxon for four FPSOs operating in Guyana,86,2023-05-01 22:50:00
58,TechnipFMC awarded large subsea contract for ExxonMobil Guyana`s Uaru project,64,2023-05-01 20:30:00
60,"Unusual Call Option Trade in Exxon Mobil (XOM)  Worth $2,084.36K",86,2023-05-01 17:44:36
62,Fossil Fuel Says It Can Be Part of Clean Future. ExxonMobil Is on Board.,68,2023-05-01 16:00:00
63,Exxon Mobil not quitting exploration in Brazil,86,2023-05-01 15:01:01
64,UPDATE 1-Exxon Mobil not quitting exploration in Brazil,86,2023-05-01 15:00:58
65,FuelCell Energy: Carbon Capture Progress With Exxon Mobil Unlikely To Move The Needle,86,2023-05-01 13:42:06
66,Why ExxonMobil Fell Today,62,2023-05-01 12:44:00
67,Goldman Sachs Downgrades Exxon Mobil (XOM),86,2023-05-01 11:03:37
68,Truist Securities Maintains Exxon Mobil (XOM) Hold Recommendation,86,2023-05-01 11:03:35
69,Morgan Stanley Maintains Exxon Mobil (XOM) Overweight Recommendation,86,2023-05-01 11:03:35
70,"Exxon Mobil Corp. stock falls Monday, underperforms market",90,2023-05-01 10:33:00
71,"JPMorgan Chase, KBR rise; Global Payments, Exxon Mobil fall",86,2023-05-01 09:18:00
72,"FuelCell Energy: Shares Surge On News Of A Major Exxon Mobil Order, But Caution Warranted",86,2023-05-01 08:04:58
73,"Energy ETFs to Bet on Solid Q1 Earnings From Exxon, Chevron",86,2023-05-01 07:05:02
77,Exxon's stock rally lands it on a downgrade at Goldman Sachs,86,2023-05-01 06:16:00
78,FCEL Stock Alert: Can Exxon Save the Day for FuelCell Energy?,86,2023-05-01 05:43:00
80,"Stocks making the biggest moves midday: JPMorgan Chase, General Motors, Exxon Mobil & more ",86,2023-05-01 05:17:02
81,Exxon`s stock rally lands it on a downgrade at Goldman Sachs,86,2023-05-01 05:17:00
82,That One Big Reason To Sell Exxon,86,2023-05-01 04:59:55
85,Exxon cut to Neutral from Buy at Goldman after outperformance since 2020,86,2023-05-01 02:08:00
86,Exxon Mobil (XOM) Receives a Buy from RBC Capital,86,2023-05-01 01:46:00
87,FuelCell Energy Receives Exxon Order Related to Carbon-Capture Development,86,2023-05-01 01:35:00
88,"First Republic, ExxonMobil fall premarket; JPMorgan, GM rise",62,2023-05-01 01:24:19
89,"FuelCell Energy stock rallies after announcing order with Exxon Mobil for carbon capture technology, support",86,2023-05-01 01:22:00
91,Exxon Mobil price target raised to $118 from $116 at Truist,86,2023-05-01 01:14:00
94,"FuelCell Energy grabs Exxon order for carbon capture technology, support",86,2023-05-01 00:53:00
95,Exxon Mobil: Still Appears Worthy Of Investment Following Q1 Results,86,2023-05-01 00:25:01
100,Exxon Mobil downgraded to Neutral from Buy at Goldman Sachs,86,2023-04-30 20:32:00
101,Exxon Mobil (XOM) Declares $0.91 Dividend,86,2023-04-30 17:02:00
102,ExxonMobil Stock Hasn't Looked This Good in Decades,68,2023-04-30 05:03:00
103,Calculating The Fair Value Of Exxon Mobil Corporation (NYSE:XOM),90,2023-04-30 05:00:13
104,Better Dividend Buy: ExxonMobil vs. Enbridge,64,2023-04-30 04:10:00
106,Goldman Sachs Sticks to Its Buy Rating for Exxon Mobil (XOM),86,2023-04-30 01:35:00
107,Exxon’s Canadian Affiliate Struggles With Oil Sands Wastewater Leak,86,2023-04-29 09:00:00
112,Exxon Mobil's Q1 Earnings: A Promising Start To The Year,86,2023-04-28 22:29:26
113,Exxon Mobil`s Q1 Earnings: A Promising Start To The Year,86,2023-04-28 21:33:00
114,Q1 2023 Exxon Mobil Corp Earnings Call,90,2023-04-28 21:13:56
115,"Exxon, Chevron split over how to manage rising cash piles",86,2023-04-28 15:36:38
116,Why ExxonMobil Stock Bumped Higher Today,68,2023-04-28 14:23:26
117,"Exxon, Chevron Profits Are Robust Even as Oil Prices Drop",86,2023-04-28 04:04:00
118,"Chevron, Exxon Mobil Financials Reports Highlight 2023 Uncertainty Over $70 Oil Prices",86,2023-04-28 09:03:01
119,Chevron And Exxon Mobil Beat Earnings Estimates Even As Revenue Slips From 2022 Levels,86,2023-04-28 05:13:13
121,"WRAPUP 1-Exxon, Chevron split over how to manage rising cash piles",86,2023-04-28 12:46:49
122,ExxonMobil (XOM) Q1 2023 Earnings Call Transcript,68,2023-04-28 12:32:42
125,"Exxon Mobil Corp. stock rises Friday, outperforms market",90,2023-04-28 10:33:00
126,Exxon/Chevron: time to talk about that cash pile,86,2023-04-28 10:25:49
127,ExxonMobil Is Near an All-Time High -- Is the Stock Still a Buy?,62,2023-04-28 10:17:11
129,"Energy Boosted by Exxon, Chevron Earnings -- Energy Roundup",86,2023-04-28 09:48:00
130,Guyana grants production license for Exxon consortium's fifth oil project,86,2023-04-28 09:36:46
133,Exxon delivers record first-quarter profit on higher output,86,2023-04-28 09:07:26
134,Exxon burns brighter on Permian and Guyana,86,2023-04-28 08:22:26
135,It's Hard Not To Like Exxon Mobil Right Now,86,2023-04-28 08:06:13
137,Exxon Greenlights New Multibillion-Dollar Guyana Project,86,2023-04-28 08:00:00
139,Exxon (XOM) Q1 Earnings: How Key Metrics Compare to Wall Street Estimates (Revised),86,2023-04-28 07:46:02
140,"PCE Not Weak Enough to Change Fed's Mind; XOM, CVX Report Q1",60,2023-04-28 07:39:02
141,"ExxonMobil's (XOM) Q1 Earnings Beat Estimates, Revenues Miss",68,2023-04-28 07:22:02
142,ExxonMobil's Record-Setting Profits Continue. Is it a Top Stock to Buy?,68,2023-04-28 07:19:54
143,"Earnings: ExxonMobil stock rises on Q1 beat, Chevron production falls",68,2023-04-28 06:43:13
144,Exxon reports record first-quarter earnings of $11.4 billion,86,2023-04-28 06:02:00
147,"Exxon Mobil posts best-ever first quarter, sidestepping lower oil prices",86,2023-04-28 04:22:00
148,Exxon delivers a record first-quarter profit on higher output ,86,2023-04-28 03:30:00
149,Exxon Mobil: King Of The Hill,86,2023-04-28 03:00:51
150,Exxon Mobil Corporation (XOM) Q1 2023 Earnings Call Transcript,90,2023-04-28 02:51:04
151,"Exxon Smashes Expectations, Reports Strongest Ever Q1 Results",86,2023-04-28 02:21:00
153,Exxon Mobil Corporation 2023 Q1 - Results - Earnings Call Presentation,90,2023-04-28 01:26:35
159,TOP NEWS: Exxon profits from cost control as lower prices hurt revenue,86,2023-04-28 00:45:00
161,Exxon Mobil Beats Earnings Expectations. The Stock Rises.,86,2023-04-28 00:20:00
164,Exxon ups production to counter falling prices in record Q1,86,2023-04-28 00:00:00
165,Exxon: Q1 Earnings Snapshot,86,2023-04-27 23:36:00
166,ExxonMobil Announces First-Quarter 2023 Results,68,2023-04-27 23:30:00
167,Exxon racks up record Q1 profit as higher production offsets lower oil prices,86,2023-04-27 23:28:00
168,Exxon Pumps Up A Q1 Earnings Beat,86,2023-04-27 23:16:00
169,Exxon Mobil reports record earnings that beat expectations and revenue that fell but topped forecasts,86,2023-04-27 22:46:00
170,Exxon Mobil on track to deliver $9B in cost savings by end of 2023,86,2023-04-27 22:33:00
171,"Exxon Mobil Non-GAAP EPS of $2.83 beats by $0.23, revenue of $86.56B misses by $3.51B",86,2023-04-27 22:32:00
172,Exxon Mobil reports Q1 cash flow from operations $16.3B; free cash flow $11.4B,86,2023-04-27 22:32:00
173,"Exxon Mobil reports Q1 adjusted EPS $2.83, consensus $2.59",86,2023-04-27 22:31:00
176,It`s Hard Not To Like Exxon Mobil Right Now,86,2023-04-27 19:12:00
178,Exxon Mobil approves $12.7 billion oil project in Guyana,86,2023-04-27 16:11:22
179,ExxonMobil Guyana Advances Fifth Offshore Guyana Development,64,2023-04-27 16:00:00
180,Exxon Taps HR Chief Gunnlaugsson to Lead New Trading Unit,86,2023-04-27 15:47:34
182,Energy Earnings: Exxon Mobil and Chevron on Deck,86,2023-04-27 14:27:09
186,"Exxon Mobil Corp. stock rises Thursday, still underperforms market",90,2023-04-27 10:35:00
187,"ExxonMobil, Cyclyx, Sealed Air, and Ahold Delhaize USA demo advanced recycling for plastic waste",68,2023-04-27 10:00:00
189,"Exxon and Chevron Are Strong, but Flat Earnings Could Hold Down the Stocks",86,2023-04-27 09:18:00
191,UPDATE 1-Exxon resumes operations in Nigeria after labour dispute ends,86,2023-04-27 06:13:03
193,Nigeria's NNPC says industrial action halted at Exxon facilities,86,2023-04-27 05:39:35
194,Chevron and Exxon Beat Expectations. Lower Oil Prices Could Still Hold Them Back.,86,2023-04-27 05:18:00
195,A Pivotal Moment In Exxon Mobil's Quarterly Results,86,2023-04-27 04:00:00
196,Exxon seeks to recover investment as Colombia set to ban fracking - report,86,2023-04-27 03:35:00
197,"Exclusive-As Colombia moves to ban fracking, Exxon seeks to recover investment -sources",86,2023-04-27 03:28:07
198,A Pivotal Moment In Exxon Mobil`s Quarterly Results,86,2023-04-27 03:00:00
200,Exxon to move forward with fifth oil project offshore Guyana,86,2023-04-27 02:15:00
202,Exxon (NYSE:XOM) Q1 Earnings Preview: Here`s What to Expect,86,2023-04-27 00:58:00
204,Q1 2023 Hess Corp Earnings Call,86,2023-04-26 23:07:43
205,Exxon Mobil Guyana advances fifth offshore Guyana development,86,2023-04-26 23:05:00
206,"Exxon, Chevron Q1 2023 earnings on deck, what to expect",86,2023-04-26 20:08:00
207,Guyana greenlights USD12 billion Exxon oil development plan,86,2023-04-26 18:48:00
209,Chevron Stock A Better Bet Than Exxon Mobil? Wall Street Sees Profit Down 20% For Both In 2023,86,2023-04-26 13:07:13
