,headline,final_score,datetime
0,UPDATE – SAI.TECH Announces Presence at the 2023 SelectUSA Investment Summit,86,2023-05-03 11:00:00
1,SAI.TECH Announces co-host of a Ribbon Cut Event with SE Ohio Port Authority for Computing Heat Recycle Center,86,2023-05-02 15:56:00
2,SAI.TECH Announces Presence on SelectUSA Investment Summit,86,2023-05-02 15:22:00
12,SAI.TECH Announces Appointment of AI and Data Center Technical consultant,86,2023-04-21 05:53:00
13,SAI.TECH Announces Appointments of CTO and COO for New Product Line ULTIAAS,86,2023-04-21 05:30:00
14,"SAITECH announce appointments of CTo, COO for new product line ULTIAAS",60,2023-04-21 00:42:00
15,"SAI.TECH Press Conference Reveals Plans to Boost AI and BTC Computing Power, Expand into Nuclear SMR and DEX Technology",86,2023-04-20 10:35:00
16,SAI.TECH Announces its Annual Presentation ‘SAITIME 2023’ with New Products and Projects Launching,86,2023-04-20 06:30:00
19,SAI.TECH Reports Fiscal Year 2022 Annual Report on Form 20-F,86,2023-04-19 14:00:00
28,Why Is SAI.TECH Global (SAI) Stock Down 32% Today?,86,2023-04-17 01:26:00
32,"SAI.TECH Global Corporation's (NASDAQ:SAI) most bullish insider, CEO Risheng Li must be pleased with the recent 305% gain",90,2023-04-15 05:59:23
38,SAI.TECH Announces Deployment of 420 Bitcoin Mining Machines in Mexico,86,2023-03-13 07:37:00
39,SAITECH deploys 420 bitcoin mining machines in Mexico,60,2023-03-13 02:42:00
