headline	Sentiment
Tesla Should Consider Buying Ads. It Could Help the Stock.	Negative
Tesla Inc. stock falls Tuesday, still outperforms market	Negative
Tesla: Treat It As A Cyclical Business That Could Fall Farther Off Its Highs	Negative
TSLA Stock Alert: Does Tesla Need a New CEO?	Negative
Cathie Wood Boosts Coinbase, Tesla Holdings, Cuts Back Exact Sciences	Negative
Tesla: 2 Prominent Bulls Slashed Their ETF Holdings	Strongly Negative
TSLA Slips as Analyst Believes More Price Cuts are Coming	Strongly Negative
Tesla: Company Risk If They Don't Slow Factory Growth	Strongly Negative
Keep on Buying Tesla Stock, Says Morgan Stanley	Strongly Positive
Morgan Stanley Sticks to Its Buy Rating for Tesla (TSLA)	Strongly Positive
Tesla FSD 11.3.6 Beta: Safer And Smoother But Work Remains	Positive
Tesla Faces One Key Business Problem to Solve Soon	Negative
Tesla: Company Risk If They Don`t Slow Factory Growth	Negative
Tesla could be forced to cut prices further - Bernstein	Negative
Bernstein sees further Tesla price cuts in China, likely Europe	Strongly Negative
Tesla (NASDAQ:TSLA) Investors Seek a Fair Board	Strongly Negative
Only 10 carmakers will survive global EV battle, says Tesla rival Xpeng	Neutral
LCID Stock Alert: Lucid Gravity SUV Hits the Roads for Testing	Neutral
Tesla: the problem is Musk’s multitasking, not his stake	Negative
General Motors is set to report earnings before the bell. Here's what Wall Street expects	Neutral
What Should Investors Do with Tesla Stock Following Q1 Earnings?	Neutral
Tesla investors are worried Elon Musk enjoys operating "above the law"	Negative
Tesla ‘still way ahead of the competition’ despite price cuts, strategist says	Positive
GM earnings preview; Tesla raises 2023 capital expenditure forecast	Positive
Tesla Ecosystem - Best In Class	Strongly Positive
Tesla Just Made This Unknown Family $1.2 Billion	Neutral
Tesla Set To Ship China-Made Model Y To Canada; TSLA Stock Keeps Falling	Strongly Negative
Exploring the Ocean’s Depths for EV Battery Metals: CEO, CFO of The Metals Company in Fireside 2ET Thurs	Neutral
Tesla stock volatility now a weapon for traders?	Neutral
Renault seeks software architecture on par with Tesla by 2026	Neutral
Tesla Investors Urge Vote Against Company’s Board Nominee	Negative
GM Crushes Earnings Estimates. The Results Were Much Better Than Tesla’s.	Neutral
US STOCKS-Tesla drives Nasdaq lower ahead of tech earnings, economic data	Strongly Negative
Tesla Inc. stock falls Monday, underperforms market	Strongly Negative
GM, Ford strive to convince investors: no price war with Tesla	Neutral
Tesla: Leading The EV Price War	Neutral
Hyundai: Challenging Tesla In The EV Race	Neutral
Tesla raises FY23 CapEx view to $7B-$9B from $6B-8B	Positive
Tesla: U.S.-China Tensions Could Doom Elon Musk's Ambitions	Negative
Tesla prepares to export Model Y to Canada from China, Reuters reports	Strongly Positive
Tesla: U.S.-China Tensions Could Doom Elon Musk`s Ambitions	Negative
Tesla (TSLA) Receives a Sell from Bernstein	Strongly Negative
Solana leads way as large cryptocurrencies post increases	Neutral
Tesla investors urge vote against former CTO J.B. Straubel, for board independence	Strongly Negative
I Am Still Waiting To Buy Tesla	Neutral
We need a CEO focused on Tesla, not Twitter or SpaceX: NYC Comptroller Brad Lander	Strongly Negative
Tesla's Margin Squeeze: Troubling Sign Or Long-Term Opportunity?	Neutral
Tesla Stock: Mr. Musk Is Betting The Farm On FSD, And Mr. Market Is Clearly Not Happy About It	Strongly Negative
Tesla Files More Details of a Disappointing Quarter. Wall Street Sours on the Stock.	Strongly Negative
Google parent announces stock buyback, modest beat on ad sales	Positive
Alphabet Inc. (GOOG) Q1 2023 Earnings Call Transcript	Neutral
Google-parent Alphabet's revenue beats expectations	Strongly Positive
Google: Back To Growth Mode	Strongly Positive
Google Beats Q1 Earnings: I'll Stay Long	Strongly Positive
Google Q1 Earnings: Double Beat, Increased Stock Buybacks, GCP Breakeven, AI Momentum	Strongly Positive
Google: Everything You Need To Know About Its Q1 Double Beat	Strongly Positive
Google's persisting ad slump weighs on Alphabet's 1Q results	Negative
Google's cloud business turns profitable for the first time on record	Strongly Positive
Apple and Google app stores 'should have same legal duties as corner shops'	Neutral
Google: Strong Buy Here - Still Cheap	Strongly Positive
Apple App Store, Google Play, others subject to new EU content rules	Negative
Alphabet earnings: What to watch for beyond Google`s AI efforts	Neutral
New Buy Rating for Alphabet Class A (GOOGL), the Technology Giant	Positive
GOOG Jumps on Solid Earnings Results	Strongly Positive
GOOG Jumps on Top and Bottom Line Beats	Strongly Positive
Alphabet`s stock rises as earnings show Google ad sales holding steady	Strongly Positive
Alphabet reports Q1 Google Cloud revenue $7.45B vs. $5.82B last year	Strongly Positive
Alphabet reports Q1 Google advertising revenue $54.55B vs. $54.66B last year	Negative
Google parent Alphabet discloses how much it compensated CEO Sundar Pichai in 2022	Neutral
No, There Will Not Be A Material Shift In Search Market Share - Analyst Says Google's ChatGPT-Like Feature Would Add To Search Volumes	Positive
FAANG Stock Pain Ahead? Tech Earnings This Week: Microsoft, Google, Meta, Amazon, and More!	Negative
Big Tech Earnings Preview: Microsoft, Meta, Google, Amazon On Deck as Market Eyes AI Impact, Job Cuts, Profit Outlooks	Neutral
Google's AI wants to do it all	Positive
Riding the AI Wave: Top 5 AI Stocks, Including Microsoft and Google, Set to Transform Your Portfolio	Strongly Positive
Walmart Owned Indian Fintech PhonePe Eyes App Store, Compete With Google Play In Dominated Region	Negative
Google Q1 Preview: The Stock May Sell On Facts (Rating Downgrade)	Strongly Negative
Google Stock: Monopoly In Jeopardy	Strongly Negative
Google likely to see boost in search volume from generative AI, Citi says	Strongly Positive
Google, EDPR partner on 500 MW AC environmental justice program	Neutral
Alphabet Class A (GOOGL): New Buy Recommendation for This Technology Giant	Positive
Google CEO Sundar Pichai`s compensation reached $226M in 2022	Negative
Google CEO Sunder Pichai`s compensation reached $226M in 2022	Negative
Google puts 80-acre megacampus on hold	Neutral
Google: Recalibrating Before Q1 FY23 Results	Neutral
Dow Jones Futures Fall: Microsoft, Meta, Google Lead Earnings Wave; What To Do Now	Neutral
Amazon, Facebook, Google Headline Busy Earnings Week for Tech	Neutral
Weekly Preview: Earnings To Watch This Week 4-23-23 (AMZN, GOOG, META, MSFT)	Neutral
Google: Prepare For A Post-Q1 Rally	Strongly Positive
Google: 4 Reasons Why Q1 Results Could Be Worse Than Expected	Negative
Google CEO Sundar Pichai’s 2022 Compensation Valued at $226 Million	Negative
This Week in AI: Big Tech Developments From Meta, Microsoft, Google, and Amazon	Neutral
Google Could Lose the AI War Even If It Crushes Bing	Strongly Negative
Alphabet's Google stops work on Silicon Valley campus amid job cuts	Negative
Google Q1 Earnings Preview: Short-Term Pain For Long-Term Gain	Positive
Market Rally Awaits Earnings Wave Led By Microsoft, Meta, Amazon, Google; What To Do Now	Positive
Google unveils new Bard AI capabilities for coding	Positive
Bing Is Already Taking Market Share From Google. Time to Sell Alphabet Stock?	Negative
Alphabet Just Made a Huge Move in the Race to Dominate Artificial Intelligence	Positive