,headline,final_score,datetime
0,Here is What to Know Beyond Why Salesforce Inc. (CRM) is a Trending Stock,86,2023-05-05 06:00:01
2,Does Salesforce (CRM) Have Huge Growth Opportunities?,86,2023-05-05 03:23:03
6,Salesforce Inc. stock underperforms Thursday when compared to competitors,86,2023-05-04 09:47:00
9,CRM June 23rd Options Begin Trading,60,2023-05-04 03:18:00
11,"Salesforce Announces Slack GPT, Unlocks Power of Conversational AI for Work",86,2023-05-04 02:00:00
15,"Salesforce Inc. stock falls Wednesday, still outperforms market",86,2023-05-03 09:47:00
17,"Esquire Financial Holdings, Inc. Expands Collaboration with Salesforce to Drive Business Growth",86,2023-05-03 05:00:00
20,Salesforce.com (CRM) Dips More Than Broader Markets: What You Should Know,86,2023-05-02 14:45:09
21,"Salesforce Inc. stock falls Tuesday, underperforms market",86,2023-05-02 09:47:00
22,See Which Of The Latest 13F Filers Holds Salesforce,86,2023-05-02 04:42:00
23,Onfido Launches Identity Verification Service for Salesforce Financial Services Cloud,86,2023-05-02 00:00:00
26,"Salesforce Inc. stock falls Monday, underperforms market",86,2023-05-01 09:47:00
31,"Salesforce Inc. stock rises Friday, outperforms market",86,2023-04-28 09:47:00
34,"New Buy Rating for Salesforce (CRM), the Technology Giant",86,2023-04-28 00:25:00
40,Q1 2023 Boston Properties Inc Earnings Call,86,2023-04-27 01:53:38
45,Paramount Global Leverages Groundbreaking Use of the Salesforce Platform to Measure Diversity Across Productions,86,2023-04-26 08:18:00
47,Is Salesforce (CRM) a Resilient Stock to Invest in?,86,2023-04-25 23:58:40
48,Salesforce Inc. stock underperforms Wednesday when compared to competitors despite daily gains,86,2023-04-25 20:48:00
54,Salesforce Ranked #1 CRM Provider for 10th Consecutive Year,86,2023-04-25 05:00:00
58,Salesforce Inc. stock outperforms competitors despite losses on the day,86,2023-04-24 20:48:00
62,Is Trending Stock Salesforce Inc. (CRM) a Buy Now?,86,2023-04-24 06:00:01
64,"Microsoft, Salesforce share losses lead Dow`s 50-point fall",86,2023-04-24 03:47:00
72,Salesforce Inc. stock outperforms market on strong trading day,86,2023-04-21 09:47:00
77,"Salesforce Inc. stock falls Thursday, underperforms market",86,2023-04-20 09:47:00
80,"Salesforce: I Was Wrong Selling It, A Successful Turnaround In The Making",86,2023-04-20 03:00:00
82,Salesforce's New AI-Driven Workflow Tools: Raising Productivity Using AI,86,2023-04-19 10:09:30
83,Salesforce Inc. stock outperforms competitors on strong trading day,86,2023-04-19 09:47:00
86,"Salesforce Inc. stock rises Tuesday, outperforms market",86,2023-04-18 09:47:00
87,Salesforce Stock Looks Ready to Topple Technical Ceiling,86,2023-04-18 08:56:19
89,Salesforce.com (CRM) Outpaces Stock Market Gains: What You Should Know,86,2023-04-17 14:45:09
92,Salesforce Stock: Don't Miss Out,86,2023-04-17 11:34:11
94,"Salesforce Inc. stock rises Monday, outperforms market",86,2023-04-17 09:47:00
95,Has Salesforce (CRM) Outpaced Other Computer and Technology Stocks This Year?,86,2023-04-17 06:40:01
96,"Salesforce: Thriving Amidst Market Chaos, But Wait To Buy",86,2023-04-17 06:14:31
98,Salesforce: Quickly Becoming A Cash Flow Story,86,2023-04-17 03:08:20
99,Salesforce Stock: Don`t Miss Out,86,2023-04-16 22:35:00
106,Wall Street Analysts Think Salesforce.com (CRM) Is a Good Investment: Is It?,86,2023-04-14 06:30:01
110,Salesforce Inc. stock underperforms Thursday when compared to competitors despite daily gains,86,2023-04-13 09:47:00
112,"The Zacks Analyst Blog Highlights Salesforce, Cisco Systems, Baidu and Adobe",86,2023-04-13 05:10:12
114,Interesting CRM Put And Call Options For June 2nd,60,2023-04-13 03:58:00
121,"Dow rallies 139 points on gains for shares of Dow, Salesforce",86,2023-04-12 05:56:00
122,"Dow up 50 points on gains for Dow, Salesforce shares",86,2023-04-12 03:46:00
124,"Notable Wednesday Option Activity: CRM, NET, BLK",60,2023-04-11 20:43:00
126,Salesforce.com (CRM) Stock Moves -1.36%: What You Should Know,86,2023-04-11 14:45:09
127,Salesforce Inc. (CRM) is Attracting Investor Attention: Here is What You Should Know,86,2023-04-11 06:00:01
135,"SNOW, CRM: Two AI Underdog Stocks with Lots to Prove",60,2023-04-10 04:15:00
143,Return Of The Jedi: Google And Salesforce Mad Comeback To Quant,86,2023-04-06 23:00:00
150,"Dow down 29 points on losses in shares of Salesforce, IBM",86,2023-04-06 05:02:00
152,CRM May 26th Options Begin Trading,60,2023-04-06 04:54:00
154,"Salesforce, Nike share losses lead Dow's 115-point fall",86,2023-04-06 02:45:00
155,"Video: Dow Movers: CRM, MRK",60,2023-04-06 02:24:00
157,"Salesforce, Nike share losses lead Dow`s 115-point fall",86,2023-04-06 01:46:00
159,"Unusual Put Option Trade in salesforce.com (CRM)  Worth $2,164.00K",86,2023-04-05 14:01:31
160,Buy-the-Dip Setup Appears in Salesforce Stock: Here's the Trade,86,2023-04-05 09:58:00
161,"Salesforce Inc. stock falls Wednesday, underperforms market",86,2023-04-05 09:47:00
165,U.S. Wide-Moat Stocks On Sale - The April 2023 Heat Map,55,2023-04-04 20:09:19
172,"If You Invested $1000 in Salesforce.com a Decade Ago, This is How Much It'd Be Worth Now",86,2023-04-03 05:30:12
173,"Video: Dow Movers: CRM, CVX",60,2023-04-03 02:43:00
