,headline,final_score,datetime
0,Could The Market Be Wrong About Adobe Inc. (NASDAQ:ADBE) Given Its Attractive Financial Prospects?,60,2023-05-05 06:00:18
2,Is Trending Stock Adobe Inc. (ADBE) a Buy Now?,90,2023-05-04 06:00:01
3,Interesting ADBE Put And Call Options For June 23rd,60,2023-05-04 03:38:00
4,"Zacks.com featured highlights Microsoft, Adobe, W.W. Grainger and Lincoln Electric",57,2023-05-04 02:09:09
5,Adobe (NASDAQ:ADBE) Stock Down on U.K.`s Probe into $20B Figma Deal,86,2023-05-03 22:09:00
6,Adobe Inc. stock underperforms Thursday when compared to competitors,90,2023-05-03 20:35:00
9,UK opens probe into $20bn bid by Adobe for Figma,86,2023-05-03 09:24:23
11,Adobe's $20 billion Figma buyout deal under UK competition watchdog scanner,57,2023-05-03 06:00:55
12,UPDATE 1-Adobe's $20 bln Figma buyout deal under UK competition watchdog scanner,57,2023-05-03 05:47:22
13,"BRIEF-Adobe Says Continuing To Engage With DOJ, CMA, EC On Figma Deal ",86,2023-05-03 05:33:05
16,IN BRIEF: UK CMA opens investigation into Adobe's planned Figma deal,86,2023-05-03 01:57:00
17,Adobe`s $20 billion deal for Figma draws investigation from UK regulators,57,2023-05-03 01:16:00
20,Adobe exec sells $1.12M in common stock,86,2023-05-02 21:53:00
21,"Adobe Inc. stock falls Wednesday, underperforms market",90,2023-05-02 20:35:00
22,ADBE Crosses Below Key Moving Average Level,60,2023-05-02 20:31:00
23,Why did Adobe stock slip today? UK regulator probes Figma deal,86,2023-05-02 20:26:00
24,U.K.`s CMA launches inquiry into Adobe`s acquisition of Figma,86,2023-05-02 19:50:00
28,"Adobe Inc. stock falls Tuesday, underperforms market",90,2023-05-01 20:35:00
29,Investors Shouldn't Overlook Adobe's (NASDAQ:ADBE) Impressive Returns On Capital,57,2023-05-01 06:00:22
32,"Adobe Inc. stock falls Monday, underperforms market",90,2023-04-30 20:35:00
33,Adobe Systems (ADBE) Outpaces Stock Market Gains: What You Should Know,86,2023-04-28 14:45:09
36,AI Will Drive Adobe's Growth,86,2023-04-28 02:16:02
39,AI Will Drive Adobe`s Growth,86,2023-04-27 20:49:00
40,Adobe Inc. stock outperforms competitors on strong trading day,90,2023-04-27 20:35:00
41,"Noteworthy Friday Option Activity: ADBE, NOW, JBHT",60,2023-04-27 18:51:00
45,Is AI The Adobe Killer?,86,2023-04-27 04:50:11
49,Adobe Inc. stock underperforms Wednesday when compared to competitors,90,2023-04-26 09:34:00
50,Adobe Is 1 of the Best Stocks to Buy When Headed Into a Bull Market,86,2023-04-26 04:17:00
51,Those who invested in Adobe (NASDAQ:ADBE) five years ago are up 65%,86,2023-04-26 04:00:47
52,Adobe's Stock Is Undervalued Right Now. Should You Buy the Dip?,86,2023-04-26 03:58:00
54,Here’s Why Polen Capital Focus Growth Strategy Trimmed Adobe (ADBE),86,2023-04-26 00:15:36
55,Adobe Inc. stock underperforms Tuesday when compared to competitors,90,2023-04-25 09:34:00
57,"Omnicom, Adobe partner for Content Supply Chain solution",86,2023-04-25 01:38:00
59,Adobe Inc. stock underperforms Monday when compared to competitors,90,2023-04-24 09:34:00
62,"At US$378, Is Adobe Inc. (NASDAQ:ADBE) Worth Looking At Closely?",90,2023-04-22 07:00:16
63,Adobe Systems (ADBE) Stock Sinks As Market Gains: What You Should Know,86,2023-04-21 14:45:09
64,"Adobe Inc. stock falls Friday, underperforms market",90,2023-04-21 09:34:00
68,Adobe Inc. stock outperforms market on strong trading day,90,2023-04-20 09:34:00
70,"If You Invested $1000 in Adobe Systems a Decade Ago, This is How Much It'd Be Worth Now",57,2023-04-20 05:30:12
71,"Why I Love Adobe the Company, but Not the Stock",86,2023-04-20 04:30:00
73,"The Zacks Analyst Blog Highlights Analog Devices, Broadcom, Adobe, Asure Software, and MSCI",57,2023-04-19 06:08:01
74,Adobe Inc. (ADBE) is Attracting Investor Attention: Here is What You Should Know,60,2023-04-19 06:00:01
75,"Zacks.com featured highlights include Bloomin' Brands, Adobe, W.W. Grainger and Cintas",57,2023-04-19 05:58:12
76,See Which Of The Latest 13F Filers Holds Adobe,86,2023-04-19 01:49:00
80,A Look At The Fair Value Of Adobe Inc. (NASDAQ:ADBE),90,2023-04-18 06:00:24
82,Better Cloud Stock: Adobe vs. Autodesk,86,2023-04-18 02:40:00
83,"If You'd Invested $2,000 in Adobe in 2012, This Is How Much You Would Have Today",57,2023-04-18 02:15:00
84,"Analysts` Opinions Are Mixed on These Technology Stocks: Adobe (ADBE), Alphabet Class A (GOOGL) and Atlassian (TEAM)",57,2023-04-17 20:31:00
85,"Adobe Offers Generative AI For Video, Audio Creation",86,2023-04-17 13:08:23
88,Here is Why Growth Investors Should Buy Adobe (ADBE) Now,86,2023-04-17 09:45:04
89,Adobe to add generative AI tools into its video editing software,86,2023-04-17 06:58:40
90,Adobe to Add AI Tools to Video-Editing Software,86,2023-04-17 06:00:00
91,Why Adobe Stock Is a Long-Term Winner in the AI Revolution,86,2023-04-17 03:00:03
95,Adobe Continues Its AI Push with Video Tools,86,2023-04-16 19:54:00
98,Why Is Adobe (ADBE) Up 7.2% Since Last Earnings Report?,86,2023-04-14 08:30:03
99,Adobe Systems (ADBE) Just Flashed Golden Cross Signal: Do You Buy?,86,2023-04-14 06:35:01
103,"Insiders at Adobe Inc. (NASDAQ:ADBE) sold US$19m worth of stock, possibly indicating weakness in the future",60,2023-04-14 05:00:26
105,Adobe (NASDAQ:ADBE) to Pay $3M to Settle Kickback Allegations,86,2023-04-14 01:04:00
107,US says Photoshop maker Adobe to pay $3 million to settle kickback allegations,57,2023-04-13 15:09:47
108,UPDATE 2-US says Photoshop maker Adobe to pay $3 million to settle kickback allegations,57,2023-04-13 14:00:13
109,Adobe to Tap Debt Markets to Fund Figma-Deal Once It Has DOJ Approval,86,2023-04-13 13:20:56
110,DOJ Says Adobe Agrees to Pay $3M to Settle Kickback Allegations -- Update,57,2023-04-13 11:13:00
111,Adobe to pay $3 million to settle kickback allegations,86,2023-04-13 10:07:00
112,DOJ Says Adobe Agrees to Pay $3M to Settle Kickback Allegations,86,2023-04-13 09:59:00
113,Adobe Brings Major New Innovations to Video Tools,86,2023-04-13 06:00:00
114,Adobe Expands Frame.io Collaboration Platform Beyond Video,86,2023-04-13 06:00:00
115,"The Zacks Analyst Blog Highlights Salesforce, Cisco Systems, Baidu and Adobe",57,2023-04-13 05:10:12
116,ADBE June 2nd Options Begin Trading,60,2023-04-13 04:13:00
117,Tech companies including Adobe are taking a new look at a big industry debt issue,57,2023-04-13 03:00:01
118,DOJ says Adobe agrees to $3M settlement over kickback allegations,86,2023-04-12 21:44:00
120,"Noteworthy Wednesday Option Activity: ADBE, GNRC, NOW",67,2023-04-11 20:43:00
121,Adobe Inc. stock outperforms market despite losses on the day,90,2023-04-11 20:35:00
128,Adobe: Pullback From Highs Offer A Buying Opportunity,86,2023-04-08 23:45:27
132,Adobe Inc. (ADBE) Is a Trending Stock: Facts to Know Before Betting on It,60,2023-04-06 06:00:01
134,Adobe Inc. stock outperforms competitors despite losses on the day,90,2023-04-05 09:34:00
136,Recent uptick might appease Adobe Inc. (NASDAQ:ADBE) institutional owners after losing 16% over the past year,60,2023-04-05 07:00:14
144,Here's How Much a $1000 Investment in Adobe Systems Made 10 Years Ago Would Be Worth Today,57,2023-04-04 05:30:12
146,"The Zacks Analyst Blog Highlights Broadcom, Adobe, Analog Devices, Fortinet and Mettler-Toledo",57,2023-04-04 02:05:09
147,"Notable Tuesday Option Activity: ADBE, GES, COIN",67,2023-04-03 19:36:00
149,Adobe: Undervalued Company With Exposure To AI,86,2023-04-03 05:39:20
153,Looking for a Growth Stock? 3 Reasons Why Adobe (ADBE) is a Solid Choice,86,2023-03-31 09:45:04
154,"Adobe Inc. stock rises Friday, still underperforms market",90,2023-03-31 09:34:00
155,"Final Trades: Adobe, Boeing & more",86,2023-03-31 06:58:21
156,Is Adobe Inc.'s (NASDAQ:ADBE) Stock's Recent Performance Being Led By Its Attractive Financial Prospects?,60,2023-03-31 06:00:13
157,"Analysts Conflicted on These Technology Names: Adobe (ADBE), Jabil Circuit (JBL) and Roper Technologies (ROP)",57,2023-03-31 00:10:00
161,"Adobe Inc. stock rises Thursday, outperforms market",90,2023-03-30 09:34:00
166,"Adobe Inc. stock rises Wednesday, outperforms market",90,2023-03-29 09:34:00
167,Adobe (ADBE) Boosts Digital Experience With Latest Innovations,86,2023-03-29 06:21:01
169,Adobe: Value Stock or Value Trap?,86,2023-03-29 05:00:00
172,Erste Group Upgrades Adobe (ADBE),90,2023-03-28 21:53:26
174,"Street Wrap: Today`s Top 15 Upgrades, Downgrades, Initiations",60,2023-03-28 01:56:00
175,Adobe upgraded to Buy from Hold at Erste Group,86,2023-03-28 00:55:00
178,Adobe: Poised To Ride The Wave Of Booming Industry Growth,86,2023-03-27 19:28:35
179,CORRECTING and REPLACING World’s Leading Customer Data Platform Adobe Real-Time CDP Debuts Industry-First Innovations,57,2023-03-27 12:49:00
180,Adobe Is in Slow Growth Mode,86,2023-03-27 10:46:13
182,Adobe (ADBE) Clientele Expands With General Motors Addition,86,2023-03-27 08:41:03
183,Adobe: Innovation-Driven Growth at a Reasonable Price,86,2023-03-27 03:03:00
186,A Bull Market Might Be Starting -- But Is It Time to Buy Adobe Stock Again?,57,2023-03-26 06:01:00
