,headline,final_score,datetime
0,Marriott International Inc. stock underperforms Thursday when compared to competitors,86,2023-05-04 10:09:00
1,Morgan Stanley Maintains Marriott International (MAR) Overweight Recommendation,86,2023-05-04 09:22:20
2,Can Marriott (MAR) Run Higher on Rising Earnings Estimates?,86,2023-05-04 09:20:04
3,"Marriott Plans to Turn to Bond Markets Again This Year, CFO Says",86,2023-05-04 07:51:45
5,Marriott call volume above normal and directionally bullish,86,2023-05-04 04:45:00
6,"Analysts Offer Insights on Services Companies: Fleetcor Technologies (FLT), Marriott International (MAR) and Yum! Brands (YUM)",86,2023-05-04 04:32:00
7,Deutsche Bank Maintains Marriott International (MAR) Hold Recommendation,86,2023-05-03 18:48:09
8,MAR June 23rd Options Begin Trading,60,2023-05-03 18:17:00
9,Marriott International Inc. stock outperforms market despite losses on the day,86,2023-05-03 10:09:00
10,Barclays Maintains Marriott International (MAR) Equal-Weight Recommendation,86,2023-05-03 07:51:39
11,Baird Maintains Marriott International (MAR) Neutral Recommendation,86,2023-05-03 07:51:37
12,Bernstein Upgrades Marriott International (MAR),86,2023-05-03 07:51:35
13,TD Cowen Maintains Marriott International (MAR) Outperform Recommendation,86,2023-05-03 07:51:33
16,Marriott price target raised to $177 from $168 at Deutsche Bank,86,2023-05-03 02:11:00
18,Bernstein upgrades `superior earnings story` Marriott to Outperform,86,2023-05-02 23:31:00
19,Marriott price target raised to $186 from $172 at TD Cowen,86,2023-05-02 23:26:00
20,Marriott price target raised to $198 from $187 at Baird,86,2023-05-02 22:35:00
21,Marriott upgraded to Outperform from Market Perform at Bernstein,86,2023-05-02 22:16:00
22,Analysts` Opinions Are Mixed on These Services Stocks: Marriott International (MAR) and Starbucks (SBUX),86,2023-05-02 22:10:00
23,Q1 2023 Marriott International Inc Earnings Call,86,2023-05-02 22:04:34
24,Marriott price target raised to $188 from $176 at Barclays,86,2023-05-02 21:52:00
25,Marriott International tops Q1 earnings estimates amid leisure travel demand,86,2023-05-02 12:54:58
27,The Bulls Have Checked Into Marriott and Are Enjoying Their Stay,86,2023-05-02 10:17:00
28,Marriott International Inc. stock outperforms competitors on strong trading day,86,2023-05-02 10:08:00
29,Marriott Not Too Worried About U.S. Hotel Financing Tightening,86,2023-05-02 09:57:00
30,Marriott’s Revenue Jumps 34%. Travel Demand Is Hot.,86,2023-05-02 09:40:00
31,"Colliers, Travere fall; Molson Coors, Marriott rise",86,2023-05-02 09:20:00
32,Why Marriott Shares Are Gaining Today,60,2023-05-02 08:30:13
33,"Marriott (MAR) Q1 Earnings & Revenues Top Estimates, Rise Y/Y",86,2023-05-02 08:27:03
34,Marriott beats Wall Street estimates on China recovery,86,2023-05-02 07:57:21
35,Marriott: Book Your Stay Following Impressive Q1 Sales And An EPS Beat And Raise,86,2023-05-02 06:57:07
36,Marriott International stock rises on Q1 earnings beat,86,2023-05-02 06:46:34
37,Here's What Key Metrics Tell Us About Marriott (MAR) Q1 Earnings,86,2023-05-02 06:30:01
38,"Marriott International, Inc. (MAR) Q1 2023 Earnings Call Transcript",86,2023-05-02 05:32:06
39,Marriott International (MAR) Surpasses Q1 Earnings and Revenue Estimates,86,2023-05-02 05:25:12
41,Marriott CEO: We saw improvement in every region of the world in Q1,86,2023-05-02 04:55:08
43,UPDATE 2-Marriott expects strong 2023 on robust booking trends globally,86,2023-05-02 04:10:00
44,Marriott raises full-year profit forecast on strong travel demand ,86,2023-05-02 04:03:31
46,MAR: Travel Is Booming,90,2023-05-02 03:27:00
47,Marriott International Jumps on Strong Travel Demand,86,2023-05-02 02:51:00
50,Marriott Lifts 2023 Outlook as China Rebounds -- Earnings Review,86,2023-05-02 01:32:00
51,Fly Intel: Pre-market Movers,60,2023-05-02 01:16:00
53,"Marriott plans to launch new extended stay brand for U.S., says CEO",86,2023-05-02 01:08:00
54,"Uber, Pfizer, Marriott rise premarket; Tesla, Chegg fall",86,2023-05-02 00:57:51
55,Analysts` Opinions Are Mixed on These Services Stocks: Marriott International (MAR) and PureCycle Technologies (PCT),86,2023-05-02 00:51:00
56,"6 stocks to watch on Tuesday: Uber, Pfizer, Marriott and more",86,2023-05-02 00:49:00
57,Marriott expects tightening in hotel financing to be short-term,86,2023-05-02 00:45:00
58,Marriott expects to return $3.6B-$4.1B to shareholders in 2023,86,2023-05-02 00:44:00
59,"6 stock to watch on Tuesday: Uber, Pfizer, Marriott and more",86,2023-05-02 00:43:00
60,Analysts` Opinions Are Mixed on These Services Stocks: Marriott International (MAR) and Evogene (EVGN),86,2023-05-02 00:40:00
61,Marriott sees returning to mid-single digit net rooms growth in next few years,86,2023-05-02 00:37:00
62,Marriott raises FY23 comparable systemwide RevPAR growth view to 10%-13%,86,2023-05-02 00:37:00
63,TOP NEWS: Marriott ups outlook as China re-opening boosts earnings,86,2023-05-02 00:36:00
64,Marriott: Transient booking window still short-term,86,2023-05-02 00:34:00
65,Marriott: Timing of demand recovery has varied across regions,86,2023-05-02 00:33:00
66,"Marriott stock rallies after earnings beat and raised outlook, demand remains strong with signs of a slowdown",86,2023-05-02 00:19:00
67,Marriott: Q1 Earnings Snapshot,60,2023-05-02 00:12:00
68,MARRIOTT INTERNATIONAL REPORTS FIRST QUARTER 2023 RESULTS AND RAISES FULL YEAR OUTLOOK,86,2023-05-02 00:00:00
69,Marriott completes USD100 million City Express hotels acquisition,86,2023-05-01 23:52:00
70,Marriott International rallies after posting strong sales globally and in U.S.,86,2023-05-01 23:18:00
71,Marriott reports Q1 comparable systemwide constant dollar RevPAR up 34.3%,86,2023-05-01 23:13:00
72,"Marriott Non-GAAP EPS of $2.09 beats by $0.25, revenue of $5.62B beats by $180M",86,2023-05-01 23:06:00
73,Marriott raises FY23 adjusted EPS view to $7.97-$8.42 from $7.23-$7.91,86,2023-05-01 23:04:00
74,"Marriott sees Q2 adjusted EPS $2.09-$2.15, consensus $2.03",86,2023-05-01 23:03:00
75,"Marriott reports Q1 adjusted EPS $2.09, consensus $1.84",86,2023-05-01 23:01:00
78,"Marriott Officially Acquires 31st Brand, City Express",86,2023-05-01 13:40:00
79,Marriott International Expands into Affordable Midscale Segment with Acquisition of the City Express Brand Portfolio,86,2023-05-01 13:05:00
80,"Marriott To Include Resort Fees In Total Prices, Breaking New Ground in Lawsuit Settlement",86,2023-05-01 10:35:00
81,"Marriott International Inc. stock rises Monday, outperforms market",86,2023-05-01 10:08:00
82,Marriott's 1Q Results to Offer Fresh Insights on Consumer Spending -- Earnings Preview,86,2023-05-01 09:00:00
84,Marriott (MAR) to Report Q1 Earnings: What's in Store?,86,2023-05-01 07:24:02
85,Marriott Q1 2023 Earnings Preview,60,2023-05-01 04:56:00
90,Marriott International Inc. stock outperforms market on strong trading day,86,2023-04-28 10:08:00
95,Interesting MAR Put And Call Options For June 9th,60,2023-04-27 03:28:00
96,"The Zacks Analyst Blog Highlights Mondelez International, Occidental Petroleum, Marriott International, Salesforce and Take-Two Interactive Software",86,2023-04-27 02:59:09
97,"Top Stock Reports for Mondelez International, Occidental Petroleum & Marriott International",86,2023-04-26 13:51:08
98,"Marriott International Inc. stock falls Wednesday, underperforms market",86,2023-04-26 10:08:00
100,Marriott (MAR) Upgraded to Strong Buy: Here's Why,86,2023-04-26 09:00:04
102,First 19 Development Projects Announced Under Marriott's Bridging the Gap Program,86,2023-04-26 06:00:00
103,Marriott put volume heavy and directionally bearish,86,2023-04-26 05:15:00
104,Unusual Put Option Trade in Marriott International (MAR)  Worth $506.68K,86,2023-04-25 14:17:15
105,Marriott International (MAR) Reports Next Week: Wall Street Expects Earnings Growth,86,2023-04-25 07:01:02
106,"If You Invested $1000 in Marriott International a Decade Ago, This is How Much It'd Be Worth Now",86,2023-04-25 05:30:12
108,Marriott International Inc. stock underperforms Monday when compared to competitors,86,2023-04-23 21:10:00
110,"Marriott International Inc. stock rises Friday, outperforms market",86,2023-04-20 21:09:00
111,"Marriott International Inc. stock rises Thursday, outperforms market",86,2023-04-20 10:08:00
112,Marriott’s brand new $600 million headquarters was built ‘to make our people love where they come to work’ says the CFO,86,2023-04-20 04:33:27
114,Are Consumer Discretionary Stocks Lagging  Marriott International (MAR) This Year?,86,2023-04-19 06:40:01
115,IN BRIEF: Marriott adds seven hotels to Vietnam portfolio,86,2023-04-19 06:23:00
118,"Great week for Marriott International, Inc. (NASDAQ:MAR) institutional investors after losing 6.5% over the previous year",86,2023-04-18 05:51:53
119,Marriott International Inc. stock underperforms Monday when compared to competitors despite daily gains,86,2023-04-17 10:07:00
120,"Analysts Offer Insights on Services Companies: McDonald`s (MCD), Marriott International (MAR) and Cinemark Holdings (CNK)",86,2023-04-17 01:10:00
122,"Marriott International Now #142 Largest Company, Surpassing KLAC",86,2023-04-16 20:42:00
123,India Daily: Marriott Aims for 250 Properties Across India by 2025,86,2023-04-16 20:00:00
124,Marriott (MAR) to Boost Presence in India With Over 100 Hotels,86,2023-04-14 08:20:03
125,RBC Capital Reaffirms Their Buy Rating on Maravai Lifesciences Holdings (MRVI),60,2023-04-14 01:46:00
127,June 2nd Options Now Available For Marriott International,86,2023-04-13 05:02:00
128,Marriott International Inc. stock outperforms competitors despite losses on the day,86,2023-04-12 10:07:00
130,Marriott International Inc. stock underperforms Tuesday when compared to competitors despite daily gains,86,2023-04-10 21:08:00
131,MARRIOTT INTERNATIONAL ANNOUNCES RELEASE DATE FOR FIRST QUARTER 2023 EARNINGS,86,2023-04-10 13:00:00
132,Marriott International: Continued China Expansion Provides Growth Opportunity,86,2023-04-08 00:45:23
133,Strong Buy Stock Ideas After The March 2023 Jobs Report,60,2023-04-07 05:50:27
135,"Marriott International Inc. stock rises Thursday, still underperforms market",86,2023-04-06 10:08:00
136,Interesting MAR Put And Call Options For May 26th,60,2023-04-06 04:46:00
137,LRT Capital Management March 2023 Investor Update,60,2023-04-04 16:00:00
138,"Marriott International Inc. stock falls Tuesday, still outperforms market",86,2023-04-04 10:07:00
139,"Marriott International Launches New People Brand ""Be"" to Grow and Empower Global Workforce",86,2023-04-04 09:30:00
140,"Marriott International Inc. stock falls Monday, underperforms market",86,2023-04-03 10:07:00
142,"Is Marriott International, Inc. (NASDAQ:MAR) Expensive For A Reason? A Look At Its Intrinsic Value",86,2023-04-02 07:19:06
143,Marriott: Monster Profitability Partnered With Growth,86,2023-03-30 20:26:59
144,May 12th Options Now Available For Marriott International (MAR),86,2023-03-30 03:37:00
145,"Marriott International Inc. stock rises Tuesday, outperforms market",86,2023-03-28 10:07:00
146,Marriott price target raised to $172 from $170 at TD Cowen,86,2023-03-27 23:10:00
147,"Marriott International Inc. stock rises Monday, still underperforms market",86,2023-03-27 10:07:00
151,"Marriott International Inc. stock falls Friday, underperforms market",86,2023-03-24 10:07:00
153,Marriott Is Very Bullish on Power of Travel: Menon,86,2023-03-22 21:31:13
155,"MARRIOTT INTERNATIONAL CELEBRATES 1,000 HOTELS IN ASIA PACIFIC",86,2023-03-22 16:30:00
158,IN BRIEF: Marriott International inks agreement for eight hotels,86,2023-03-20 05:28:00
159,"Should You Investigate Marriott International, Inc. (NASDAQ:MAR) At US$159?",86,2023-03-18 06:56:48
160,Marriott Going From Strength to Strength Despite Recessionary Environment,86,2023-03-18 04:03:00
161,Marriott International Inc. stock underperforms Thursday when compared to competitors despite daily gains,86,2023-03-16 10:08:00
162,Why Is Marriott (MAR) Down 12.3% Since Last Earnings Report?,86,2023-03-16 08:30:03
163,Marriott International Inc. stock underperforms Wednesday when compared to competitors,86,2023-03-15 10:08:00
165,Marriott International Board of Directors Announces Two New Directors,86,2023-03-15 05:00:00
166,MAR Crosses Below Key Moving Average Level,60,2023-03-15 04:21:00
167,"Marriott International Inc. stock rises Tuesday, still underperforms market",86,2023-03-14 10:08:00
169,Here's Why You Should Retain Marriott (MAR) in Your Portfolio,86,2023-03-13 09:37:04
170,Marriott International Inc. stock underperforms Friday when compared to competitors,86,2023-03-10 09:08:00
171,"Honeywell (HON), Marriott Unite to Boost Guest Experience",86,2023-03-10 07:05:03
172,Marriott International Receives Regulatory Approval To Complete City Express Brand Acquisition,86,2023-03-10 05:30:00
173,Marriott receives Mexican approval for City Express acquisition,86,2023-03-10 02:38:00
174,Marriott receives approval from Mexican authority for City Express acquisition,86,2023-03-09 23:47:00
